Company,Quandrant,Year,Summary,Linguistic Complexity(Flesch Scores),Sentimentmorganstanley,q3,2018,"The first half of the year was characterized by a strong market environment and increased levels of client activity.Commensurate with that backdrop, we delivered returns above the top end of the ROE target range of 10% to 13% over that first half period.
In the meantime, we remain confident and optimistic about the near-term prospects for a strong finish through 2018.I will now turn it over to Jon, who will discuss the quarter in detail.Jonathan Pruzan -- Chief Financial Officer, Executive Vice PresidentThank you and good morning.
And compensation expenses were $1.6 billion, bringing the year-to-date compensation to net ratio revenue to 34.5%.Investment banking reported revenues of $1.5 billion, down 14% relative to the second quarter, reflecting a normal seasonal slowdown in activity.
The growth in these metrics supported higher asset management and net interest revenues, contributing to the 2% sequential increase of total quarterly revenues of $4.4 billion.The business continues to demonstrate significant operating leverage.
Year-to-date results demonstrate that we can steadily grow this business, while continuing to make investments into tools to support asset growth, increase client engagement and improve cost efficiencies.In Investment Management, we saw continued positive long-term flows, $3 billion in the quarter, supported by strength in overseas distribution.
On a year-to-date basis, Asset Management revenues are up 13% on strong investment performance and positive flows, particularly in our active fundamental equity strategies.
We have seen a little bit more of a shift into the fixed income investing than we did -- probably what we saw in 2017, but all in all it's been a -- sort of both a nice way to supplement liquidity in the bank, but also bring in new assets to the Firm.Brennan Hawken -- UBS -- AnalystTerrific.
Are there any limits to thinking about further share gains, particularly in the financing side of the business?Jonathan Pruzan -- Chief Financial Officer, Executive Vice PresidentListen, Brennan, as you mentioned, we've gained significant share over the last four or five years.
Again, we try to focus on the net interest income in the wealth business and you can see that that business, the NII has grown about 4% to 5% year-to-date.On the first question, it's a good question Mike and we continue to make investments in the liability structure.
What's been the range of those cash levels, like over the last five or 10 years?Jonathan Pruzan -- Chief Financial Officer, Executive Vice PresidentI think over five, I would say 8% to 10%, but now down to 6%.
Your line is open.Matthew O'Connor -- Deutsche Bank -- AnalystGood morning.Jonathan Pruzan -- Chief Financial Officer, Executive Vice PresidentGood morning.Matthew O'Connor -- Deutsche Bank -- AnalystRevenue obviously was strong this quarter, it's been strong year-to-date, it sounds like it's off to a good start this quarter.
And then if there's still further optimization that you can do to the CET-1 after going up 90 bps this quarter?James Gorman -- Chairman and Chief Executive OfficerWell, it's obviously -- it's kind of a -- apart from where goes the market from here, the second question is what is likely to evolve on the regulatory front, not just in 2019, but over the next three or four years.
Can you give us an update on the what -- how this impacts your business, maybe specifically in IM with -- like the investment line?Jonathan Pruzan -- Chief Financial Officer, Executive Vice PresidentSure.
So I think it will continue to see some impact from that, but I think again that's the sort of the tail on the dog, the primary driver of revenue growth for us in that business is going to be around the fee based assets.
Basically the businesses have been optimizing their balance sheet and their funding and that's sort of collectively the net result being the statement we made in the press release that the net funding costs are down, it's really based on usage, not rate.Guy Moszkowski -- Autonomous Research -- AnalystAnd is there any sustainability to that or -- just in terms of the lower funding costs or it was just something that was helpful this quarter?Jonathan Pruzan -- Chief Financial Officer, Executive Vice PresidentI think it was helpful this quarter.
Just curious on how big and what business that was?Jonathan Pruzan -- Chief Financial Officer, Executive Vice PresidentYes, that was a deal that was announced I believe in the second quarter, closed in the third quarter.
I was hoping you could give us some insight about how you think about earnings resiliency in a sustained market correction and given some of the commentary around the movement in cash balances, how much of an offset do you think that could provide if equity market -- weakness persists?James Gorman -- Chairman and Chief Executive OfficerI mean, listen, we had a more challenging third quarter, both from market activity and just seasonal volumes, and we delivered an ROE of -- what was it -- 11.5% in that environment.
So we're not as correlated to equity market movements as I think is sort of believed, if you actually look at the stability of the franchise across each of the businesses.Now, clearly if you have a sustained correction, call it 20% every year, we're affected by that.
I was wondering from your perspective, how you think about balancing the need to continue to deliver margin improvement versus some of the higher investment needs as you look out for other growth opportunities.James Gorman -- Chairman and Chief Executive OfficerYes. Honestly, I think you're raising a very good point and I don't -- if that's the view of some people on the Street, I don't understand that view.
So how has dialogue gone, how do you convince or think about the stress test and how that impacts your ability to return even more capital, given that your ratios are dramatically higher than your peers?James Gorman -- Chairman and Chief Executive OfficerYes, Jim, it is the question and I'll start and we should spend some time and I want Jon to weigh in on this, because he's been pivotal to all the discussions we've had in DCM with our regulators.
As you kind of see that loan growth, should we except margin to -- can continue to move a little higher?Jonathan Pruzan -- Chief Financial Officer, Executive Vice PresidentYes, I think that's the right characterization.
And then just to follow up here, maybe good to get a little more perspective on just the investment banking activity levels in the various businesses.
We have seen a little bit of consolidation with MiFID going into place as people reduce the number of counter-parties they deal with, but I think the general comment was generally the top providers, top three or top four, top five, depending on the market, where the product have generally been gaining share and we would expect that that trend will continue.OperatorThank you.
And thirdly, meaningfully investing in our culture to ensure we remain an employer of choice for top talent and manage our business with professionalism with whatever challenges we face.These strategic choices were designed to ensure that as much as we can control, the Firm does well in a strong market (technical difficulty) demonstrates stability in a seasonally or structurally more difficult one.
Wealth Management delivered another solid quarter and Investment Management saw continued positive long-term net flows, although investment results were impacted by weaker emerging markets.We continue to benefit from the inherent operating leverage of our business model.
Year-to-date revenues of $16.7 billion are up 17% versus the same period last year, benefiting from active global markets, increasing revenue pools and stable to improving wallet share.
Activity remained healthy across products and regions with particular strength in IPOs. Americas was strong throughout the quarter, while Asia and Europe saw some seasonal slowdown in August before a strong September.Fixed income underwriting revenues were $508 million.
Increased results in investment grade issuance partially offset a slowdown in high yield financing relative to a very active second quarter.
Event-driven transactions remain a significant driver, supported by the active M&A backdrop and our ability to leverage our global franchise to provide holistic client solutions.
Sequential revenues declined across each business line as the quarter was characterized by low market volumes and more subdued volatility compared to the first half of the year.
And derivative results were also strong, aided by a diversified product set and client mix.Fixed income revenues of $1.2 billion were down 15% versus the second quarter.
Rates was negatively impacted by range-bound yields and low volatility globally.Our credit business saw a sequential decline on lower client activity across product areas.
Despite seasonal headwinds this quarter, our revenues remain solid.Turning to Wealth Management.
Net fee-based flows also remained strong at $16 billion, contributing to 3% growth in fee-based assets, which now stand at $1.1 trillion or 45% of total client assets.
In addition to the traditional decline in retail engagement during the summer months, we saw clients continue to focus more of their fixed income investing into shorter duration products at lower commission rates.
However, due to the impact of positive mark-to-market on deferred compensation plans, total transaction revenues of $698 million remained essentially unchanged.
On a year-to-date basis, transactional revenues represent approximately 16% of total net revenues versus 22% in the same period three years ago.This quarter's results once again demonstrate the stability and health of our wealth business.
Our supplementary leverage ratio remained flat at 6.4%.During the quarter, we repurchased approximately $1.2 billion of common stock or 24 million shares.
",32.19,0.8194778
morganstanley,q4,2018,"The results of 2018 CCAR translated into a flat total capital distribution to 2017 CCAR, a position we believe we can improve upon going forward.Moving to slide five, stability is critical when markets are volatile.
The ROE of that business almost doubled to 20% over the last six years.On slide 12, the industry has experienced a secular shift away from transactional toward advisory accounts with service fee-based assets.
As we noted last year, Investment Management is a business positioned for growth and we're executing on that opportunity, as evidenced by strong growth in asset management fees since we refocused our efforts on Investment Management in late 2015.Across our business lines, we are seeing strong investment performance by management client partnerships and distribution and continued product innovation.
A key part of the strategy also includes inorganic growth, driven by new talent, team lift-outs and acquisitions in areas we believe we can deliver differentiated value to our clients.Taken as a whole, slide 16 illustrates the operating leverage of this institution.
We will be looking for similar bolt-on acquisitions within both, our Wealth and Investment Management businesses.Lastly, while not a point of growth, we reiterate that given our business mix and model and our capital base, we will look to achieve 100% payout ratio going forward, subject to obviously the regulatory approval and any acquisition opportunities that may come our way.Our management team remains committed to executing on our long-term strategy and fulfilling our strategic objectives.
In addition to the challenging market dynamics, factors specific to Morgan Stanley further impacted quarterly results, namely sharp losses to the investments associated with employee deferred compensation plans, had a considerable impact on transactional revenues in Wealth Management.Additionally, we made slight modifications to the Firm's incentive compensation, subject to deferral schedules, in order to bring them more in line with peers.
Non-compensation expenses of $1.9 billion increased 8% versus the prior quarter, primarily driven by execution-related costs and seasonality.While the difficult backdrop weighed on market making, client activity remained robust.
The compensation ratio for the quarter and full year was approximately 31% and 34%, respectively.Investment banking revenues of $1.4 billion, declined modestly from prior quarter, consistent with lower industry volumes.
We expect to retain our leadership position and finished number one globally for the fifth consecutive year.Fixed Income results for the quarter were weak against a challenging market backdrop.
Both seasonal factors and increased economic uncertainty related to growth and rate outlooks for 2019 and beyond, influenced markets, resulting in rapid movements in spreads and asset prices.Credit was impacted by a significant widening of spreads toward the end of the year.
And on a full year basis, asset management revenues increased 9%, a function of higher fee-based client assets, driven by markets and flows.Total client assets of $2.3 trillion in the fourth quarter decreased 8% sequentially, reflective of broader market movements.
Total US Bank deposits of $187 billion, increased 7% versus the third quarter, driven by higher deposit sweep balances.In particular, our bank deposit program benefited from seasonality and clients holding more cash in the phase of volatile markets.
Net interest income of $1.1 billion increased 2% versus the prior quarter and 4% over the full year.We expect 2019 annual NII growth to be in line with loan growth.
Increased lending penetration, the adoption of digital tools, fee-based asset flows and minimal attrition, indicate an engaged financial advisor population and a business position to grow.
Asset management fees of $628 million grew 4% versus the third quarter, driven by a significant amount of the year's performance fees being recognized in the fourth quarter.This increase was a result of the revenue recognition accounting rule change implemented early this year.
As we have previously said, this line has the potential to be lumpy, though we continue to see broad-based gains in our private alternative strategies.Other revenues were impacted by an impairment of a legacy non-controlling interest and a third-party asset manager.
While we cannot predict how these dynamics will unfold in 2019, we are focused on growing and supporting our clients and are prepared to respond to market environments with appropriate actions.Although the asset pricing witness at the end of the year will have an impact on first quarter results, markets have settled into tighter ranges and historical relationships have broke down in the fourth quarter have realigned.
Gorman -- Chairman and Chief Executive OfficerGood morning.Guy Moszkowski -- Autonomous Research -- AnalystFirst question, I wanted to ask was just, I recognize in Wealth Management, there were some moving parts that had to do with two different deferred comp programs, one being the one that affects both the expense and the revenue lines equally and we've seen that before.But it appears that there was another one that had a one-time impact on costs.
So, a new issue coming to market, the banking calendar being positive, clients see something that's attractive out there to participate in and they start getting moving and the advisors are calling them.
So, I don't see -- again, I've been doing this a very longtime and this is not a period where I would say you're seeing any fundamental shifting client attitude or confidence.You definitely have a very low level of transaction, which we've had for two years and it's got increasingly lower and even pushed into more money being cashed through the fourth quarter.
Pruzan -- Executive Vice President and Chief Financial OfficerHey, Mike.Mike Mayo -- Wells Fargo Securities -- AnalystI'm struggling with the quarter, understanding exactly what happened.
Pruzan -- Executive Vice President and Chief Financial OfficerI think there's a couple ways to think about it on both revenue and expenses and also time.
Gorman -- Chairman and Chief Executive OfficerWhy don't I start on this and let Jon talk about how to think about the institutional business and expense management versus growth.
Gorman -- Chairman and Chief Executive OfficerGood morning.Gerard Cassidy -- RBC Capital Markets -- AnalystCan you guys give us some color?
And just what you're seeing in that market and maybe compared to prior time periods where you guys were involved in that business?Jonathan M.
Pruzan -- Executive Vice President and Chief Financial OfficerAgain, we obviously have multiple products, mortgage being one, the securities-based lending business, tailored lending within the wealth segment.
Regarding Investment Management, it's fair to say, we are positioning the business for growth, but it's still early days.On capital return, we increased our dividend to $0.30 per share, and had a buyback of $4.9 billion.
We believe that the stability of our team and business model compared to an industry, much of which is still going through change, should enable us to continue to take market share.Moving to slide nine.
Within the year, we saw patches of overperformance, as well as underperformance, obviously, in the fourth quarter.The net result of an 11.5% ROE, excluding intermittent discrete tax items, demonstrates that we're on the right track.
We are confident in this institution's ability to deliver both future profitability and performance at the levels that we've outlined.I'm going to now turn the call over to Jon, who will talk about the fourth quarter in detail, the annual results and then, of course, we'll take your questions.Jonathan M.
Although these factors are not material for the annual results, adjustments can be amplified in any given quarter and impact the segments in slightly different ways.Now to the businesses, our Institutional Securities business reported revenues of $3.8 billion in the quarter, a 22% sequential decline.
We saw clients derisk and delever in the second half of the quarter.Advisory, however, remained strong and we had our best quarterly results in over 10 years.
That said, persistent volatility and changes to sentiment could impact our ability to bring transactions to market.In equities, the business performed well.
Volatile market conditions, including the severity of intraday and intraweek movements impacted performance in cash and derivatives in the fourth quarter.In prime brokerage, the results remain strong.
We are critically and credibly sized for the opportunity and are well positioned to continue to support our clients.Wealth Management finished a strong year on a weak note impacted by the decline in asset prices and the impact of market volatility on investment banking revenues.
Overall, segment revenues were $4.1 billion for the quarter.Over the last several years, the impacts from our employee deferred compensation plans have had limited impact on both revenues and pre-tax margin.
The growth in annual revenues and the limited increase in non-comp expenses, while still investing in the platform, highlight the businesses extraordinary benefits of scale.The PBT margin was 24.4% for the quarter.
Higher asset levels at the end of the third quarter helps insulate these revenues against the market's decline in the fourth quarter.
Given the number of factors that can distort any individual quarter, we continue to manage this business with a long-term lens.
We would expect the margin to rebound in the first quarter, and we are confident in our ability to deliver our 26% to 28% margin objective in 2019.Investment Management reported revenues of $684 million, a 5% increase sequentially.
In fact, several years ago we just thought it was a little over the top and we were pushing too much, frankly too much revenue in the future years, which is mortgaging your future and not healthy and we adjusted that one time.In the last couple of years, with particularly our more junior employees at the sort of associate VP level, if you look at where they were deferred relative to the street, they were clearly an outlier.
And again, over a long period of time -- excuse me, over the annual basis, the deferred comp plans have generally been pretty -- have not really impacted the PBT.But we did obviously see a 14% decrease in the S&P in the quarter, and within wealth based on the mix of how those employees invest their assets in the deferral schedules, you saw a bigger revenue impact there.
And I would -- as I mentioned in my script, if you take those, as well as the seasonality as well as some of the volatility we saw in the investment banking or I guess in the calendar revenue, which you can see in the supplement, the margin would have been closer to the full year margin, had those impacts not occurred.OperatorThank you.
And backdrop on the traditional side of the business, we know that Morgan Stanley sold the retail component of its business and alternative world is growing.So, you gave us a look on check mark in each asset class, but can we sharpen that a little -- focus a little bit more and say, why now, what particular focus, and then maybe how you think about investing in that business versus say buying back stock at book value?James P.
Gorman -- Chairman and Chief Executive OfficerYeah , I mean, if the stock stays at -- if the stocks at $42 or whatever it is, going to open up this morning, that's -- I kind of like buying that all day long, to be blunt.
Listen, the Investment Management platform is very interesting.We are, I think, as the slide shows, we have very good loan-only business.
We had very good flows into managed equities, which is -- and obviously the Street did not experience that, so that's a positive.Our fixed income businesses has typically being small -- not typically, it is smaller than we would like.
So, we plan all of those and if we can drop in a series of sort of string a pull type acquisitions across the platform, while we are driving organic growth in the actively managed, which is the high-margin business, we have better scale in the fixed income platform.
It's just something that given, obviously, the disappointing sort of stick at the price numbers of some of the stuff that it affects things like the margin Wealth Management because as I said, $40 million, $45 million is a point of margin.
I don't think you are going to -- we're not talking bull market rebound obviously.
On the other hand, it could be Morgan Stanley of old, where you had hiccups in fixed income like the second half of '15 or 2013 or during the financial crisis.So my question is, how much of this quarter, the fourth quarter, I get, you got your targets for the year, but I'm really talking about the fourth quarter.
I don't really see it -- I certainly don't see it as a B, which is Morgan Stanley of old, if you will, the sort of episodic volatile shifts, overdependence on propositions, big marks, misplaced trades, major integrations going on, at the same time, selling businesses, writing stuff off, it's not bad.
As I said, we had good client activity, part of facilitating our market-making businesses, standing in between flow and that flow was tough this quarter.
And again, we think it's a real nice opportunity over the medium to longer term to bring in more clients and more assets into the business.OperatorThank you.
And then I guess, specifically within the Institutional Securities, you've had really nice market share gain in the investment bank, as well as across the trading businesses in the past couple years.
Since some of the volatile, like line items, when I think about the institutional, business like the other line that credit flows through, investment line that was negative and then even the deferred comp, was there anything in the fourth quarter that was more like realized losses versus mark-to-market that if the market continues to stabilize, we would expect some normalization there?Jonathan M.
And we feel very good about sort of that book-of-business and being able to bring that to market assuming these conditions continue to holdOn the CLO front, as you know, we are an active securitizer.
",30.98,0.8485817
