Company,Quandrant,Year,Summary,Linguistic Complexity(Flesch Scores),Sentiment
morganstanley,q1,2018,"In Institutional Securities alone, the dominance of Equities, the strength of Fixed Income, and the breadth of Investment Banking generated over $6 billion in revenue.Along with the rest of the industry, we recently submitted our 2018 CCAR plan.
However, as demonstrated by recent market dynamics, future activity may be impacted by regulatory, macroeconomic, and geopolitical factors.Our Sales and Trading businesses produced revenues of $4.4 billion, up 64% quarter over quarter.
I think what we've talked about coming into the -- throughout last year as well as coming into this year was a couple of factors that we suggested would slow down NII growth in this segment, and that's what we obviously saw this quarter.
We also told you last year that we thought that the deposit deployment strategy that we had in place was going to play out, and we were planning on diversifying our deposit and liability structure, which we obviously have done.What we have seen -- and, we talked about this last year and again this year -- our clients are deploying more cash into the markets, and they're putting it into different types of investments.
So, I think this is actually playing out as we expected, and it is going to be growth, but it will be slower.Sharon Yeshaya -- Head of Investor RelationsThank you.
What's the plan for how long that would stay on the balance sheet, and does this provide a pipeline for some DCM activity here over the coming quarters?Jonathan Pruzan -- Chief Financial OfficerThere's a lot of questions in there, and I would basically say yes to all of them, but let's just quickly tick off.
Again, within Fixed Income, there are lots of businesses -- macro, micro, corporate trading, commodities -- but within our SPG business, a larger percentage of that line item over time will be coming from these lending activities, and we've seen good growth in that area.
It does give us some stability, and we like the credit characteristics and the yield characteristics of that business, and we'll continue to try to grow it going forward.Sharon Yeshaya -- Head of Investor RelationsThank you.
I know it's an impossible question, but should we be expecting seasonality of the past, given the higher activity levels in those specific components this quarter?Jonathan Pruzan -- Chief Financial OfficerI'm glad you prefaced that by saying it's an impossible question, which means -- actually, I'm going to go back to Brennan's question because I realized I didn't answer the second part, and then, Glenn, I'll get back to you.
The flex is obviously how strong the markets are, reflecting the new issue calendar, which pumps up the banking, reflecting Equity activity depending on the div/of season, what time of the year it is, and then, obviously, Fixed Income.
A lot of that has gone away, so Fixed Income won't have the huge ups that we had in 2006 and 2007, most of which we gave back, but it's unlikely to have the kinds of downs that we had before we got rid of the physical stuff and restructured the business.So, I think the range of this firm is kind of a worst-case scenario without the market completely imploding around $7.5 billion a quarter.
Obviously, in a good market, a seasonally strong market, an active market -- all which we had in the first quarter -- slightly lower tax rate, slightly lower preferred that we have every other quarter, then you're going to be toward the higher ends of your ranges.Glenn Schorr -- Evercore ISI -- Managing DirectorI appreciate that.
The other question I just wanted to pick up on that was something that Jonathan mentioned in his remarks was the concept of the bid offer, which was up very strongly in the early part of the quarter -- I guess across a wide range of product.
So, there's things we could do, clearly, to drive returns higher, putting aside revenue growth, but what we're focused on is how are we going to do in a difficult market environment?So, seasonally, just add in the extra preferred, bring the tax rate up to 23% to 25% range that Jon talked about, and the returns for this quarter probably drop from 14.9% to -- rough math -- about 14%.
One follow-up on terms of environment -- now that you have $70 billion of loans, up almost 20% year over year, how do you reassure investors that these loans will stay of good quality?Jonathan Pruzan -- Chief Financial OfficerAgain, I think from the overall credit quality, there's a couple of components.
As rates rise, we'll also see presumably less run-off, but again, we feel good about where we are in terms of the lending growth -- slower first quarter, but as expected.Gerard Cassidy -- RBC Capital Markets -- AnalystVery good.
The volumes have gone up dramatically, so although there are different dynamics around voice versus electronic, we've been making up a lot of it in volume, but there is clearly pressure on the voice trading part of the business.Gerard Cassidy -- RBC Capital Markets -- AnalystThank you.Sharon Yeshaya -- Head of Investor RelationsThank you.
On the non-comp side, we expected some lip with the activity, but maybe just some color on what's being driven by activity versus what -- you guys mentioned some of the investments in Wealth Management -- what we should be expecting as more ongoing.Jonathan Pruzan -- Chief Financial OfficerAgain, I think based on our expectations and budgets, we actually were right in line with what our expectations were on the non-revenue-related items, and then we saw a clear increase in BC&E, which shows up in the BC&E line, an increase in transaction taxes, increases in U.K. bank levy, and some of the other things that would show up in the other expense line.
So, anything around transparency around the scenarios -- and, that's one of the things that we're going to comment on, and I think Vice Chairman Quarles mentioned something about putting out the scenarios for comment -- any of that would be helpful for us to plan our business because we look at things for the longer term, and to get a surprise year after year based on the scenario does obviously inhibit some of that long-term strategy planning.Sharon Yeshaya -- Head of Investor RelationsThank.
Just a follow-up on that -- James, as you said, you've built more stable, you think stable, revenue-producing business model, yet when we look at the stress tests, you get hit the hardest in terms of starting point to stress minimum, in terms of loss rates.
Some of that this year is going to be a function -- as you know, a significant portion of our revenues and wealth comes from our fee-based flows, and if your markets are down 65% and they don't ever recover, that obviously has an impact on our business.The other thing you should know is all these tests -- we're not allowed to make any sort of management action, so we just watch all of this go on and have no ability to react to it.
Gorman -- Chairman and Chief Executive OfficerAnd specifically on us, historically, we said the constraint was leverage ratio, and as the models in the Fed have done, you grow your balance sheet, then that's highly punitive.
Again, the way I would describe this -- first of all, I think you've heard James talk a lot about this business being ballast, so it's not going to move quarter over quarter sequentially very much.
It looks like you're gaining market share, so I want to understand what you're doing globally, but also in Europe in particular in this area.Jonathan Pruzan -- Chief Financial OfficerAgain, I would say broadly, Fixed Income was strong.
We remain appropriately sized to take advantage of active markets when they present themselves.Investment Banking demonstrated sustained strength despite new-issue markets being punctuated by periods of elevated volatility.
For the quarter, a combination of continued advisory growth supported by secular trends and the business' scale-driven operating leverage produced record pre-tax profit of $1.2 billion.
At the same time, we continue to actively invest in the business, building out our digital offerings, banking products, and technology capabilities more broadly.Investment Management again witnessed net long-term inflows over the quarter as the team continues to produce strong investment returns across both alternatives and public markets.
In the quarter, we closed the Mesa West acquisition and made several key hires.We've often said that wealth and investment management give us ballast, and our other businesses make up the engine that drives this firm forward in more active markets.
We believe we are sufficiently capitalized and expect to maintain our attractive capital return profiles over coming years.As we look forward, our objectives remain the same: To execute on our strategy and deliver on the medium-term goals laid out at the beginning of this year.
Our Institutional Securities businesses benefited from increased trading volumes and the return of healthy volatility across many asset classes.
Revenues were $2.6 billion, up 33% sequentially, on strengths across all products and all regions.Derivatives had a very strong quarter as episodes of volatility created significant trading activity and strong client demand for hedging solutions.
Our securitized product group had one of its best quarters in close to four years, driven by strength in Europe and a more active trading backdrop.
The increase was driven by higher market volatility and facilitation of increased client activity.Turning to Wealth Management, revenues of $4.4 billion were down 1% quarter over quarter as continued growth in asset management was offset by the impact of mark-to-market undeferred compensation plan investments.
On a year-over-year basis, non-compensation expenses were flat despite an 8% growth in revenues.Total client assets were essentially unchanged at $2.4 trillion, reflecting softness in domestic and international equity indices.
Fee-based assets continue to be a source of long-term organic growth for the business, supported by both conversions from brokerage and net new asset flows into the firm.
As a result, fee-based assets reached a new high of $1.1 trillion or 45% of total client assets.Asset management revenues were $2.5 billion.
Over time, we believe that these advancements will enable our advisors to provide better advice and service and broaden their client relationships.In Investment Management, revenues were $718 million, up 13% sequentially, driven by higher asset management fees and the absence of last quarter's impairment charge.
Although we saw outflows in our liquidity business as clients managed their cash balance needs around the turn of the year, our long-term strategy saw continued positive flows.
Investment revenues were $77 million, down by 31% relative to last quarter, impacted by lower market performance in certain private-equity-related funds.
This quarter's results demonstrate that increased levels of activity and client engagement are broadly beneficial to our business.
",35.28,0.83269703
morganstanley,q2,2018,"Whatever transpires this quarter, we remain confident in the medium-term goals we laid out at the beginning of the year and are well on track with each of them.I'll now turn the call over to Jon.Jonathan Pruzan -- Chief Financial OfficerThank you, and good morning.
Institutional securities generated revenues of $5.7 billion in the second quarter.Continued strength across investment banking, equities, and fixed income has contributed to year-to-date revenues of $11.8 billion, our strongest first half of the year, excluding DVA, since 2007 and a 19% increase versus the same period last year.
In our macro business, we saw strong client activity in FX.Rates was impacted by range-bound yields in the second half of the quarter.
The initial phase of the redesign became effective at the end of the quarter, resulting in approximately $10 billion of incremental sweep deposits.This increase was partially offset by outflows in the quarter, primarily driven by taxes and a continued market deployment.
But we're very comfortable with our overall positions, Glenn.And when we think about our risk profile and our business mix, we like the business that we're doing, and we're very happy with the results.Glenn Schorr -- Evercore ISI -- AnalystOK.
That -- in other words, you're not chasing hot CD rates.You're providing high rates to people that bring more balances to their Morgan Stanley relationship.Jonathan Pruzan -- Chief Financial OfficerAgain, certainly, the -- in the wealth management channel, the new CD promotional rates and savings rates have been for new money, as you said.
And I think everybody is kind of taking a little pause on that and trying to figure out what is the right level of capital you need in the financial system to fund economic growth and what's the right leverage of the institutions.
I guess, first question here just on the retention loans and wealth management, where, I think, the balance was $3.6 billion at last quarter.
I'm just trying to kind of think about the moving part here because I know it's important to the kind of the forward margin story.Jonathan Pruzan -- Chief Financial OfficerI'll try to take some of those.
higher rev, higher comp, higher sales and trading results, higher BC&E and transaction taxes.The one other area that you're seeing good growth is, really, I guess, from an FCC-disclosure standpoint, the IP and T line, which is where you'll see some of the impact of our technology investments where we continue to make those investments to improve technology, both outward facing and inward facing across the whole plant.
But the bank will remain a very important source of growth over many years and then our geographic repositioning, particularly in Asia, where we're investing stronger than we need to, for example, in the U.S. So a huge amount going on.We might not be making a lot of announcements about it, which is fine.
What are the goals from some of these investments?Jonathan Pruzan -- Chief Financial OfficerYes. I would say that you've sort of highlighted what our expectations are.
And although we've made significant investments and had a lot of technological change within the business, these trends are going to play out over a significant number of years.
And probably more importantly, just how you're thinking about managing risk because it does seem more consistent than a lot of the peers in the industry.Jonathan Pruzan -- Chief Financial OfficerWell, thank you for that.
We feel very good about the risk profile of the business.And it's really driven based on our client relationships and client activity and client flows.OperatorOur next question comes from the line of Jim Mitchell of Buckingham Research.
And that's kind of an adjustment that I think and hope will be more appreciated over time in the way the models are constructed under the stress test.If you just look at the stability of that business quarter after quarter, it's pretty evident that even in very difficult markets, it remained stable.
So I think that the -- that change is going to be a net positive.But as we transitioned from the old platform to the new platform, we obviously were very sensitive to the customer experience and effectively slowed down that business.
Your line is now open.Christian Bolu -- Bernstein -- AnalystGood morning, guys.Jonathan Pruzan -- Chief Financial OfficerGood morning.Christian Bolu -- Bernstein -- AnalystJust quickly on the sweep changes that you've made to the deposit program, so, I guess, $20 billion, $10 billion from this quarter and -- $10 billion from last quarter and $10 billion going forward, is that it?
Or is there more that you think you can generate after that?Jonathan Pruzan -- Chief Financial OfficerWell, again, from the redesign itself, that will be it.
So is the right way to think about that, you're going -- the capital ratio should be increasing over the year?
Or irrespective of client activity, you have the ability to grow the balance sheet and keep the capital ratios flat through the year?Jonathan Pruzan -- Chief Financial OfficerYes. I think -- I mean, we have that flexibility.
And if there are opportunities to support clients and invest that capital into the business at a good return, we'll do that.OperatorThank you.
I will keep my remarks brief today when describing the quarter's performance, as the results are relatively straightforward.This is the second quarter the firm generated revenues in excess of $10 billion.
Investment banking and equities reported very strong results, and fixed income continued to perform well.Wealth management remained solid.
We will not get ahead of ourselves in predicting what the Fed will do next year, but 2018 appears to be a transition year.Going forward, we expect to be able to continue to invest in our business and offer our shareholders an attractive capital return, while maintaining a prudent capital base.
Year-to-date revenues were $21.7 billion, a firm record after excluding the impact of DVA in prior periods.Second-quarter diluted EPS was $1.30, ROE was 13%, and return on tangible common equity was 14.9%.
Investment banking performed very well as new issue markets remained open and receptive to corporate strategic activity.
Equity sales and trading was buoyed by active global markets, and fixed income benefited from strong client flow.We delivered solid results across Wealth and Investment Management, our sources of more stable revenues.
In investment banking, all products and regions performed well, generating revenues of $1.7 billion.The results represent a 12% increase versus a strong first quarter.
Clients remained engaged, and pipelines are healthy.New issue market conditions remained favorable in the quarter, with significant investor demand across both equity and fixed income, supporting strong underwriting results.
Clients in Asia continue to be active, including a number of large IPOs in the quarter.Fixed income underwriting results increased 4% sequentially to $540 million, with stable results across both high-yield and investment-grade issuance.
Derivatives and cash revenues remained robust, although lower in -- than in Q1 as market volatility and global volumes trended lower.Fixed income continued to perform well, with quarterly revenues of $1.4 billion.
Each business line saw a sequential decline versus a very strong Q1, but divisional revenues were up 12% year over year.
Net interest income was $1 billion for the quarter, down 2% sequentially, driven primarily by lower prepayment amortization gains.Year-to-date NII of $2.1 billion represents a 5% increase.
While funding in the U.S.banks grew by 2% to $70 billion in a seasonally strong quarter, as clients use their SBL lines to manage liquidity through the tax season.
A flatter yield curve has also shifted clients investing into shorter-duration products at lower commission rates.Consequently, transactional revenues of $691 million was down 7% sequentially.
Fundamentals remained strong.Our sources of annuitized revenues continued to grow with consistent fee-based flows and record balances for both fee-based assets and loans.
Year over year, revenue has grown 13% driven by continued strong investment performance and positive flows, particularly in our active fundamental equity and multi-asset strategies.
Our first-half results have been strong with two consecutive quarters with revenues greater than $10 billion.All of our businesses are positioned for growth and to support our clients if activity levels remain high.
Curious on how you think about the opportunities given your relationships with the sponsors and then how that factors in from a ""what you're willing to risk"" perspective.Jonathan Pruzan -- Chief Financial OfficerSure.
Good morning.Jonathan Pruzan -- Chief Financial OfficerGood morning, Guy.Guy Moszkowski -- Autonomous Research -- AnalystSo let me just follow up, if I might, on Glenn's question about the deposits.
Just help us think a little bit, from a very big picture point of view, how you're thinking about deploying deposit funding, despite the fact that it's clearly getting more expensive.Jonathan Pruzan -- Chief Financial OfficerSure.
But maybe there was some incremental tech invest.How should we think about that line as a jumping-off point from here?Jonathan Pruzan -- Chief Financial OfficerYes. There's marketing and business development.
And we've probably made more strategic change to this institution in the last five or eight years than we made in the previous 80.We had a wealth management business in 2006 that had revenues of $5 billion and pre-tax profits of $300 million.
Are they getting more conservative, less conservative in that leverage loan business, please?Jonathan Pruzan -- Chief Financial OfficerSure.
Is there any way for you to be able to take advantage of where -- at least where current market rates are and be able to either maybe extend duration or not even extend duration, just at current coupons to create a little bit higher yield in that portfolio?Jonathan Pruzan -- Chief Financial OfficerYes. I would say that we're very comfortable with our ALM position.
",39.6,0.42826787
