Company,Quandrant,Year,Summary,Linguistic Complexity(Flesch Scores),Sentimentmorganstanley,q1,2019,"Across the board, ROE, ROTCE, the Firm efficiency ratio and wealth management margin are in line with or at the higher end of our strategic objectives, ensuring a very solid start of the year.Consistent with our objective to invest for growth, we announced our intent to acquire Solium Capital, a leading global software provider for equity administration, financial reporting and compliance.
Compensation expenses were $1.8 billion resulting in a compensation to net revenue ratio of 35%, consistent with last year's ratio.In investment banking, we generated revenues of $1.2 billion, a 19% decrease relative to the fourth quarter.
Strong non-compensation expense discipline and the benefit of the retention note roll off more than offset the effect of lower asset values, resulting in a margin of 27.1%.As demonstrated during the quarter, we have leveraged to protect the margin, while still investing for growth.
First question is on non-comp expense, we saw a pull back nicely here in the quarter.
Can you help us think about how we should think about the amount of flex that you have in that line to potentially offset environmental pressure if we see that flaring up again, maybe a bit of a context around fixed versus variable?Jonathan Pruzan -- Chief Financial OfficerYeah sure, I'll take a shot and as you said, we thought we had a nice quarter on the non-comp side.
We did also see as you would expect, year-over-year a decline in some of the execution-related expenses given the decline in revenues, but again a nice quarter for us on the expense side, 71% efficiency ratio, well below our target of 73%.Brennan Hawken -- UBS -- AnalystOkay.
It, obviously, wasn't cheap on a multiple basis, so I see it as buying the technology and giving us access to a new channel with multiple verticals into it.Jonathan Pruzan -- Chief Financial OfficerAnd then just briefly on timing, we would expect the deal to close shortly.
I mean, there's a lot of chatter in the market about the number of IPOs upcoming and I guess you get more than your fair share in tech IPOs, can you quantify, kind of what you're seeing, what's in the pipeline, what maybe a little after the pipeline for the period you compare this to?Jonathan Pruzan -- Chief Financial OfficerI will try to give you a little bit more context, although I think the adjectives were our attempt to give you that context.
That's a broad-based franchise that we're very confident in and as you know, given the sort of December hangover, the earnings season as well as the government shutdown, we did see a significant portion of the IPO calendar get pushed out, not canceled but pushed out.We also then saw over the course of the quarter increasing buildup of the pipeline in the IPO products.
I mean, the bottom line, the business has scale, a point margin on $4.4 billion of revenues, $44 million.
And the first quarter just shows the benefit of scale and our ability to pull levers and sort of manage between growth and investment.OperatorThank you.
We have a lot of confidence in that business and continues to do well.On the equity side, we came into the quarter with activity levels low and average balances or balances quite low given the volatility in the December timeframe.
I would assume there were some offset in comp, but if you could just sort of help with that?Jonathan Pruzan -- Chief Financial OfficerSure and I would say, you sum it up properly, which is that the PBT impact both in terms of dollars and margin is actually quite minimal.
And it's clearly a strong result, I just want to gauge how much of that strength is recurring and what we should be comfortable run rating in our models?Jonathan Pruzan -- Chief Financial OfficerThe three components on the MSIM, again, the fee-based revenue I mentioned, the performance fees and then investments can be lumpy.
It was fees.Jonathan Pruzan -- Chief Financial OfficerAgain, fees in general, there is -- we feel very good about the results, there wasn't anything particularly unique in the results outside of the investment management comments I made about investments being lumpy and the performance fees.
Or how should we think about the go forward here?Jonathan Pruzan -- Chief Financial OfficerAgain, it was a nice non-comp quarter.
I think the deal is closing in May. Am I right, Jon?Jonathan Pruzan -- Chief Financial OfficerSure.James P.
Gorman -- Chairman and Chief Executive OfficerThere'll be some integration costs with that, some technology investments and so on, that's not, obviously, huge given just the size of the business, but that may bounce the numbers around a little bit over the next couple of quarters.
We have a $17 billion revenue business in Wealth Management that has nothing to do with Solium right now.
Jon, do you want to add to that?Jonathan Pruzan -- Chief Financial OfficerNo. I think your focus is right in terms of both Wealth and IM, sort of more of the fee-based type businesses, less balance sheet intensive, and that's really what the focus has been.
I mean, I think, first and foremost, I would just say one, there's just been less movement of people both in and out and that's good for stability of the platform, the ability to build relationships and continue to invest, so that's a positive.
But just talk about some of those dynamics and the flexibility you have specifically in comp, and layer the retention and the roll-off -- sorry, and the front ending of some compensation in 4Q?Jonathan Pruzan -- Chief Financial OfficerI'll try to take that in two components.
On the ISG side, you saw the comp ratios sort of consistent with last year's first quarter.
Thank you.Jonathan Pruzan -- Chief Financial OfficerYep.OperatorThank you.
Jon.Jonathan Pruzan -- Chief Financial OfficerYes. And again, I would look at the asset management space, it's not necessarily in totality.
While activity was not as robust as early 2018, the improvement in sentiment, CEO dialogue and Boardroom conversations are all encouraging.Our wealth business absorbed lower fourth quarter asset levels and delivered strong results.
We remain confident in the Firm's outlook and broader economic activity, but we're cognizant that global risks are more balanced.Against this backdrop, we remain very focused on expense discipline while still investing for growth.
Through Solium, we gained a new scalable channel and direct sales force, giving us the ability to target another client population, particularly a younger demographic in its wealth accumulation phase.On a combined basis, we will now have direct exposure to over 2.5 million individuals via Solium's Workplace Services complementing the over 3 million wealth management clients, our financial advisors already serve in our traditional business.What excites us is the expansion into the workplace, delivering financial wellness services to clients and offering financial advice, education and the ability to transact through their employer.
Still, the Firm produced solid results, revenues of $10.3 billion declined only 7% year-over-year compared against the strongest quarter in the Firm's history, ex DVA.On a sequential basis, revenues increased 20%.
Importantly, there has been a pickup in activity levels and pipelines are healthy.Turning to underwriting, new issue market conditions were more challenged at the outset, but issuance built momentum as the quarter progressed.
Revenues were $2 billion declining 21% year-over-year and increasing 4% quarter-over-quarter.On a sequential basis, derivatives and cash revenues improved with derivatives benefiting from improved markets and corporate activity, In prime brokerage, sequential and year-over-year revenue declines were driven by lower average balances.
While market indices have rallied materially and sentiment has improved, clients remain cautious.First quarter fixed income results were strong following the traditional seasonal pattern.
The market was generally characterized by tightening credit spreads, declining interest rates, low volatility and uneven client activity across business lines as well as benefits from structured client activity.Macro rebounded broadly on a quarter-over-quarter basis.
Micro results were robust both sequentially and annually, driven by particular strength in corporate credit.Tightening credit spreads and increased secondary trading activity resulted in higher client revenues.
Despite lower starting asset levels, the business produced a PBT margin of 27.1%, demonstrating resilience despite large market draw downs in the fourth quarter.Total client assets ended the quarter at 2.5 trillion, an 8% increase versus the prior quarter, reflecting positive asset flows to the Firm and the rebound in asset prices.
The 8% decline from the prior quarter was primarily driven by last quarter's lower ending asset levels.Total bank lending ended the quarter at $71.5 billion while funded balances declined slightly quarter-over-quarter, driven by a handful of large pay downs in the tailored lending book and a modest decline in security-based lending, commitments did rise.
The rise in commitments and solid mortgage growth over the quarter are encouraging and we continue to expect mid-single digit percentage loan balance growth for the full year.Net interest income growth of 3% to $1.1 billion was primarily driven by the benefit of the December rate increase and the corresponding impact on our investment portfolio yields.
Investment management produced very strong results, revenues of $804 million was up 18% sequentially and were the highest for the segment in over five years.
As noted historically, this line item has the potential to be lumpy.Total AUM of $480 billion was up 4% versus the prior quarter with long-term AUM of $321 billion increasing 7%.
Asset management fees of $617 million were down 2% sequentially, the higher management fees on the back of improved average AUM over the quarter were offset by lower performance fees.As we have met mentioned before, as a result of the revenue recognition accounting rule implemented in 2018, a significant amount of any year's performance fees will be recognized in the fourth quarter with a small amount being recognized in this first quarter.
Total expenses increased by 3% quarter-over-quarter driven by higher carry compensation, which offset a decline in non-comp expenses.Turning to the balance sheet, total spot assets of $876 billion increased 3%, driven by client activity, primarily in equity sales and trading and ISG lending.
Markets in the second quarter have been constructive, pipelines are healthy in investment banking and higher asset levels will support fee-based revenues in our Wealth Management business.We are keenly aware that open and functioning markets and economic stability are instrumental in supporting confidence and activity levels moving forward.
And then switching gears to Solium, James, I know you referenced it and provided some high level context around how you're thinking about it strategically.
My guess is, it's primarily a Wealth Management customer acquisition tool potentially, but I would think that it might play in a bit on the banking side too particularly in developing relationships with privates.
So again, we feel very good about the mid single-digit guidance on loan growth and NII, even though clearly expectations around rates in the forward curve are different than when we started the beginning of the year.Steven Chubak -- Wolfe Research -- AnalystNow, thanks for that color.
I was just wondering if you could provide any insight into how much of that fee strength that we saw in Investment Management, transactional activity in Wealth and other sales and trading is sustainable.
",33.41,0.7778589
morganstanley,q1,2020,"And they were natural consequences of the market turmoil, namely the decline in deferred compensation plan investments, and increase in the amount of prepayment amortization.Notwithstanding all of this, the firm generated $9.5 billion of revenues and an ROTCE of 9.7%.
And in the meantime, we will continue to do our part for broader society.I will now turn the call over to Jon, to discuss the results of the first quarter in greater detail, our perspectives on the outlook given the current environment, and then take it back where we'll both answer your questions.
In late March, we reached the recent low in balances as market levels declined and we saw our clients significantly degress.We entered the second quarter with lower spot balances down close to 30%, and a more challenged environment in Europe.
Higher asset levels at the beginning of the first two months of the quarter helped insulate these revenues from the subsequent market decline in March.
E*Trade will hold the shareholder vote this summer, and we remain on-track to close the transaction in the fourth quarter.Taken in full, we are very pleased with the firm's results and stability of the business model.
But there are several factors that will impact our earnings power in the near term, including lower asset values and balances, interest rates near zero, as well as volatility and economic uncertainty impacting Capital Markets and M&A volumes.The second half of the year remains uncertain and the path of the economy will be driven by the time it takes to resolve the health crisis and the impact of the unprecedented fiscal and monetary response.With that, we will now open the line for questions.Questions and Answers:OperatorThank you.
Where do we take hits across the various parts of the plant, and you're going to take them whether it's in the margin book, whether it's in the asset management portfolios, whether it's in the trading businesses and had it all of that look.Now, we didn't have a full quarter of being in absolute crisis.
And for this moment, we've come through that and generated $9.5 billion of revenue and that's net of the deferred compensation plans which actually puts us bit over $10 billion in revenue, effectively flat to a year ago, I thought was remarkable.Now, maybe it's my job to think that's remarkable.
But it clearly puts us in a much better position.I think our BDP, which is our cheapest source of deposits, which currently have a cost of 1 basis point is now about 65% of the portfolio.
And I think our deposit costs at the end of the quarter were about 56 or 57 basis points, and those should come down a little bit as we've just repriced our savings product down in light of the rate environment.So, I would say we should, you know, if we have the opportunity to deploy those deposits into loans, we'll see a benefit there, clearly.
Appreciate it.Brennan Hawken -- UBS -- AnalystSo, could you speak a bit maybe -- Jon, you gave some color on the $49 billion HFI portfolio, which is helpful, thanks.
It's about 58% LTVs to the top tier borrowers in the real estate business and we have good protection in the asset.So, the forbearance has mostly been, Brennan, in the CRE book right now, and then again, a little bit in the residential mortgage that I mentioned.Brennan Hawken -- UBS -- AnalystYes. Okay.
Really appreciate that, Jon. So, how do you adjust to those things and what levers are you thinking to pull on the expense side here as the revenue -- if the revenue environment continues to get difficult?James P.
We, obviously, and just the timing of all of the events, we updated our models for what was going on at the time when we got to the end of the quarter in light of what we were seeing and the rapidly changing sort of the economic outlook, which at this point, I would say, and James has mentioned it a couple of times, the range of potential outcomes is the widest I've seen in quite some time in terms of what's going to happen in the future.And so, we relied heavily on the sort of qualitative and environmental reserve and we looked at the downgrades, we looked at what loans we thought would be downgraded, the stress draw scenarios, we did some loss given default sensitivities, we looked at criticized asset trends and we've factored all of that into our analysis that ultimately led to the $350 million reserve build on the entire portfolio, or a 74% increase from our Day-1 CECL.So, the economic scenarios are going to impact people differently across the plant.
Our Retail and Wealth business had very little reserve build given the performance in that portfolio in the company.
But we think the qualitative adjustments that we made are appropriate and brought our reserves to an appropriate level.Steven Chubak -- Wolfe Research -- AnalystThanks, Jon. James, maybe a question for you.
As James said, you're going to take businesses where you trade and put with your clients, there's the potential to take losses.
I know we got to deal with lower rates and lower asset levels going down, but I'm just trying to get the right context.
I'm just looking for the right big picture, your view of wealth management.Jonathan Pruzan -- Chief Financial OfficerAgain, I think -- and James can jump in as well, but I've mentioned $500 million of negative revenue, so that puts the revenues in around $4.5 billion.
I was just wondering on the fixed side, any significant changes that you've seen in that business to try to gauge the outlook?Jonathan Pruzan -- Chief Financial OfficerAgain, it's very early in the quarter.
Jon, can you share with this -- I think you mentioned that coming out at the end of the quarter, in Wealth Management, 23% of your customers assets were in cash.
Over 90% of our employees are currently working from home as we continue to serve our clients globally.I frequently speak of the strength of Morgan Stanley's culture and our tenured leadership team.
With market function and liquidity essentially restored, clients are weighing the major factors at play, including significant unemployment and economic disruption versus monetary and fiscal actions larger than any others in history.During this period, the firm extended credit and intermediated trading, responding to client needs and supporting open and functioning markets.
We also saw approximately $13 billion gross drawdowns, $5 billion of new facilities in corporate lending and $3 billion retail commitments.We supported our clients by intermediate trading, including managing record volumes across voice and MSET.
Robust results in Sales and Trading were offset by mark-downs on held-for-sale loans, increased loan loss provision and lower levels of investment banking activity.
Non-compensation expenses increased 14%, driven by higher BC&E and transaction taxes on elevated sales and trading volumes and an ACL on unfunded commitments of $115 million.In the face of uncertain markets, we supported our institutional clients with insightful content.
First, underwriting activity was impacted as the global shelter-in-place action started to roll across the world, followed by significant volatility which dampened M&A dialog and announcements.Advisory revenues declined 45% sequentially, reflecting lower completed M&A industry volumes.
This was partially offset by an increase in accelerated primary offerings and secondary activity as we helped clients across the globe monetize equity stakes.Fixed income underwriting declined 11% versus the prior quarter.
Issuers continue to evaluate financing needs, looking to strengthen their balance sheets and raise liquidity.We have a strong pipeline across products and equity underwriting and a robust pipeline in investment grade and non-investment grade business, which are dependent on market access.
We would expect IPO activity to remain muted and we'll have to see whether other markets continue to open around the globe.Equity sales and trading is number-one globally and revenues increased 26% sequentially to $2.4 billion, with strong performance across all business lines and particular strength in Asia.Cash results were robust, reflecting the nearly 50% increase in global market volumes compared to the prior year.
The business benefited from higher levels of client activity and wider bid offer spreads.Micro revenues were more challenged and declined sequentially.
Strong commodity results were supported by increased client activity driven by meaningful swings in energy and metal prices.Other Sales and Trading increased significantly in the quarter.
Together, the ACL provision and mark-to-market, net of hedges, accounted for approximately $900 million of the aforementioned loss; and third, losses from investments associated with employee deferred cash-based compensation plans represent approximately $200 million of the law.Now, I will give some more color around our CECL provisioning for our $49 billion held-for-investment loan portfolio.
Client activity was extremely strong, reflecting high levels of engagement throughout the quarter as clients repositioned portfolios and moved into cash and other short-term securities.
Today, clients sold approximately 20% of assets in cash and short-term securities.Asset Management revenues increased slightly from the prior quarter.
Positive flows partially offset these lower asset levels.We had fee-based flows of $18 billion and generated strong net new assets at a pace above our historical run rate, highlighting the stability and health of this business.
Our growth strategy is working as clients are seeking professional advice during turbulent times, particularly with increased complexity.Strong loan growth continued in the first quarter.
We had extensive engagement with our global clients throughout the quarter and the business continued to see strong net flows despite the challenging environment.Total AUM rose 6% to $584 billion.
Total net flows of $57 billion benefited from a significant new long-term client partnership and our liquidity business.Asset management fees of $665 million declined 10% sequentially.
Gorman -- Chairman and Chief Executive OfficerThank you, Christian.Christian Bolu -- Autonomous Research -- AnalystMy first question is on ROTCE for the firm, how to think about downside ROTCE?
I mean, given you are putting up 10% ROTCE in what is a very choppy backdrop, how should investors now think about the downside case for the firm is a 10% or close to 10% ROTCE now your bottom line as opposed to a couple of years ago what was your actual long-term target?James P.
Gorman -- Chairman and Chief Executive OfficerHey, Steve.Steven Chubak -- Wolfe Research -- AnalystHey. I was hoping you could help us frame following the significant provision build that we saw in ISG this quarter.
And how do you see them bringing that down over the subsequent months or quarters?Jonathan Pruzan -- Chief Financial OfficerIt's a great question in terms of how our retail clients are going to reengage with the market.
",33.01,0.7568499
