Company,Quadrant,Year,Summary,Linguistic Complexity(Flesch Scores),Sentiment
amazon,q1,2016,"These capital expenditures and capital leases reflect additional investments in support of continued business growth due to investment in technology infrastructure, the majority of which is to support AWS, and additional capacity to support our fulfillment operations.
In the first quarter of 2016, we began to allocate stock-based compensation and other operating expense net to our segment results.
For reference, this quarter, I'll also mention segment operating income excluding stock-based compensation and other.
North America segment operating income, including stock-based compensation and other, was $588 million, a 3.5% operating margin compared with $254 million in the prior year.
International segment operating loss, including stock-based compensation and other, was $121 million, compared with a loss of $194 million in the prior year.
International segment operating income before stock-based compensation and other was $20 million, compared with a loss of $76 million in the prior year.
Amazon Web Services segment operating income, including stock-based compensation and other, was $604 million, a 23.5% operating margin compared with $195 million in the prior year.
Consolidated segment operating income before stock-based compensation and other was $1.7 billion or 5.7% of revenue, compared to $706 million in the prior year.
Your first question on international, yes, all three segments had very strong growth in the quarter.
As we may have mentioned in the past, we feel that Europe and large countries in Europe and Japan are a few years behind the U.S. on a lot of the key Prime metrics, but we also said last year that Prime subscriptions were up 51% year-over-year in 2015, 47% in the U.S. and a higher rate than that internationally.
So certainly, a lot going on in international, a lot that's really good, adding Prime subscribers at a high clip, continuing to add selection at FBA sellers.
Just wanted to ask you about unit growth overall and if we look back over the last three quarters, you've accelerated it now to a materially higher level than what we saw in 2014 and the first half of 2015, and I realize in 3Q last year you had Prime Day. And as you open up six new regions in coming months, should we expect this to be constant build-out or something that's more lumpy over time and more in waves?
I think when we look at the bridges for revenue, and obviously units are a key driver of revenue, things like Prime are key in that bridge.
We're very pleased with the quarter, we came in at 23.5% operating margin on a â the new basis including stock-based compensation and other.
But stepping back with the 64% growth in AWS which is now a $10 billion business, but on the margin side, I would caution you that we're pleased but it is very early to start drawing too many conclusions on the long-term margins in this business, they'll be bumpy over time.
At any point in time they're going to reflect the balance of investing including global expansion that he's talked about, price reductions we may offer, and also driving cost efficiency, which for us is a very important driver in not only this business but also the North America and international segments.
And on your AWS footprint question, so we ended the quarter with 33 Availability Zones in 12 geographic regions, and we have five â 11 more Availability Zones opening in the next year.
We love the â customers love the content and we like the results we see, particularly around Prime free trial conversion and renewal rates for subscribers who use and take advantage of Prime.
But we think that's working and look forward to bringing a lot of new content to our Prime subscriber base, both through our normal Prime subscription and also the monthly plan that you alluded to.
We will continue to add fulfillment capacity, we will work with FBA sellers on inventory stocking and timing and we think that there's things that we can do better as we do every year, come out of fourth quarter with immense learnings.
And secondly, Brian, you said that the growth of Prime has been driven by investments you have made and are making.
So we think there's a lot of room to grow in not only our international countries, but also in the U.S. So we plan on continuing to build the benefits of the Prime program from music to video, to two-day shipping, to same-day shipping, to Prime Now. And again, it remains the best deal in retail.
We're very pleased with the results we're seeing on the top and bottom line, but margins are going to be bumpy and affected by levels of investing, price reductions and also cost efficiencies that we're driving.
Wanted to understand how we should think about the puts and takes in gross margin, it has evolved to be a much higher number over the last couple of years, what some of the puts and takes are going forward especially with respect to content costs?
I think the bigger issues that you should look at in gross margin, and again starting with the comment that we expanded by 300 basis points year-over-year, that is really driven by, first of all, the AWS growth and again, $10 billion business growing 64% is very â we're very pleased with that and that affects gross margin as well.
So we have stepped up investment, although it did not go up as much year-over-year this quarter, we are still spending almost $10 billion on what essentially is fulfillment capacity in support of really strong growth, unit growth and FBA, and global expansion and then also on AWS, additional capacity for existing customers as they grow their business and also new regions.
We are not in the business of raising prices, we lower prices for AWS, so there can be mix for products, but by and large, if you see our revenue growth, know that we are also lowering prices which means that by math, we are typically going to be growing usage at a very strong rate.
And it's a lot of the drivers we talked about, as Brian mentioned on the revenue growth side, Prime, selection, growth.
Yes. And on AmazonFresh, we continue to have a strong Fresh business in a number of cities in the U.S. We know customers love it.
I think you see the growth rate of the segment at 27%.
The other thing I would add to that is that the margin you see in any quarter is really the output of our rate of investment at some places and drive for efficiencies in others.
The following discussion and responses to your questions reflect management's views as of today, April 28, 2016 only and will include forward-looking statement.
Trailing 12-month operating cash flow increased 44% to $11.3 billion.
Trailing 12-month free cash flow less finance lease principal repayment and assets acquired under capital leases increased to $1.6 billion, up from an outflow of $1.2 billion.
Worldwide revenue increased 28% to $29.1 billion or 29% excluding the $210 million unfavorable impact from year-over-year changes in foreign exchange.
These amounts are combined and titled stock-based compensation and other in our segment results and reflect the way we now evaluate our business performance and manage our operations.
North America segment operating income before stock-based compensation and other was $924 million, a 5.4% operating margin compared with $517 million in the prior year.
Media revenue increased 7% to $2.5 billion or 9% excluding foreign exchange.
Amazon Web Services segment operating income before stock-based compensation and other was $716 million, a 27.9% operating margin compared with $265 million in the prior year.
Inventory increased 30% to $9.6 billion and inventory turns were 8.6, down from 8.8 turns a year ago as we expand selection, improved in-stock levels and introduced new product categories.
Our results are inherently unpredictable and may be materially affected by many factors, including a high level of uncertainty surrounding exchange rate fluctuations as well as changes in global economic conditions and customer spending, world events, the rate of growth of the Internet, online commerce and cloud services, and the various factors detailed in our filings with the SEC.
Our guidance further assumes that we don't conclude any additional business acquisition, investments, restructurings or legal settlements, record any further revisions to stock-based compensation estimates, and that foreign exchange rates remain approximately where they've been recently.
Our next question comes from Douglas Anmuth, JPMorgan.
Our next question comes from Mark Mahaney of RBC Capital Markets.
Can you talk about how you're thinking about planning against that as the Prime flywheels are getting broader for you, how do you try to get ahead of that into the peak season later this year?
Our next question comes from Carlos Kirjner with Bernstein.
I think it's a mathematical certainty that Prime subscribers will decelerate in North America at some point from 50% growth.
So over 26% growth in this quarter alone coming off a year where I believe the number was 722 significant new features and services delivered for AWS customers last year.
Our next question comes from Brian Pitz of Jefferies.
They're quite a bit below where they were many years ago and trailing the U.S. Maybe talk about the dynamics there and what is it going to take to catch up over time?
Our next question comes from Eric Sheridan of UBS Investment Research.
Our next question comes from Aaron Kessler of Raymond James.
Our next question comes from John Blackledge of Cowen & Company.
Our next question comes from Ron Josey of JMP Securities.
",52.43,0.6635299
amazon,q2,2016,"Additional information about factors that could potentially impact our financial results is included in today's press release and our filings with the SEC, including our most recent annual report on Form 10-K and subsequent filings.
Trailing 12-month free cash flow less finance lease principal repayments and assets acquired under capital leases increased to $2.5 billion, up from an outflow of $492 million.
Worldwide revenue increased 31% to $30.4 billion or 30%, excluding the $166 million favorable impact from year-over-year changes in foreign exchange.
North America operating income was $702 million, a 4% operating margin compared with $348 million in the prior year.
Excluding the $184 million year-over-year favorable foreign exchange impact, revenue growth was 28%.
Amazon Web Services' operating income was $718 million, a 24.9% operating margin compared with $305 million in the prior year.
This guidance anticipates approximately 30 basis points of favorable impact from foreign exchange rates.
Our guidance also assumes that we don't conclude any additional business acquisitions, investments, restructurings or legal settlements and that foreign exchange rates remain approximately where they have been recently.
Our next question comes from Douglas Anmuth from JPMorgan.
Our next question comes from Gene Munster from Piper Jaffray.
Our next question comes from Heath Terry from Goldman Sachs.
Our next question comes from Carlos Kirjner with Bernstein.
Our next question comes from Jason Helfstein from Oppenheimer.
Our next question comes from Colin Sebastian from Robert W.
Our next question comes from Brian Pitz from Jefferies.
So I would just say Prime Day had enormous impact on the device business and devices were well featured and also well adopted by customers.
Our next question comes from Eric Sheridan from UBS.
Our results are inherently unpredictable and may be materially affected many factors, including fluctuations in foreign exchange rates, changes in global economic conditions and customer spending, world events, the rate of growth of the Internet, online commerce and cloud services and the various factors detailed in our filings with the SEC.
Yeah, let me talk a little bit about guidance and I'll incorporate the answer to the fulfillment question.
So, you'll notice on the top line guidance of $31 billion to $33.5 billion or 22% to 32% growth incorporates the Prime Day results and I can talk more about that later.
And we're nearly tripling our number of new Amazon Original shows â TV shows and movies compared with the second half of last year.
I'd point to India and AWS, but primarily the two biggest issues in Q3 guidance I would say are the operational ramp and also the increase in digital content spend.
In terms of questions, the customer count, can you give us a little bit of guidance on that?
And then also talk about the theme of automated consumption and separately, the importance of Prime Now and how you can kind of grow those SKUs. Darin Manney - Director, Head of Investor Relations, Amazon
Of course, we do always talk about â we always usually get asked about profitability and it is a very hard service to deliver and make money on, but we know customers love it and we're in a great position to do this because of our long-term approach, our drive of greater efficiencies and our proximity to the customer with our vast global FC network.
I was wondering as it relates to the Q3 guidance, can you give us a bit of a sense of just how we should think about margins in the AWS business, especially as the next eight availability zones roll out?
But to your question about AWS, we actually see nine availability zones in four regions coming out in the next â in the coming year.
The impact on short-term is pretty much indistinguishable from the growth that we're seeing in our expansion of our base customers in our existing regions, so we don't see a large step-up from the addition of new regions relative to the large and rapid growth in the business itself.
As I look at your tech and content expense as a percentage of revenues, we see year-on-year decline for the last two quarters, which is something we hadn't seen since mid-2010, and of course it's reflected in the AWS margins.
So, there's a lot of great work going on there and I think that's what you're seeing reflected in the tech and content line.
So, the move into Boston and also now into London give us some really good data points and as â it's a great customer feature for the Prime offering.
Some of the products overlap, of course, but we're happy with both, and we think that customers like both of them.
I remember last quarter you called out really starting to see, kind of I don't know, critical mass tipping point, whatever the buzzword is, from Prime and from FBA in international markets.
So it's a bit as simple as that in the consumer business in North America and international, we are seeing great acceptance of Prime and usage of Prime benefits.
We continue to expand the list of Prime benefits for customers to make it more valuable, and none is more valuable than FBA, which we've talked a lot about the value of Prime to FBA and vice-versa.
We've talked a bit about our Prime launch in India, and alluded to the fact that we'll be having video soon in India, but local content and also Amazon Originals.
So we take both roles very seriously around here, investing on the right â in the right things, seeing results on behalf of customers, and also driving efficiencies.
And there can be timing, quarter-to-quarter, the operating margin and levels of investment can fluctuate, but certainly continue to expand.
We are certainly expanding our service offerings in the transportation side and we have been for many years, things like sortation centers and delivery methods.
And then second thing, when you look at the U.S. Prime penetration versus total U.S. customers, how do you feel about that and do you think there's still a lot of room for Prime growth in the U.S.?
We know that, again, when customers try Prime, they like it.
Let me take that first question on Prime Air in the UK, we've been working with and developing Prime Air for some time to develop a rapid delivery system that is safe, environmentally sound and it really enhances the services that we provide for millions of customers.
You heard that we launched the Prime program this week, which will be a whole new experience for Indian customers.
We think it'll enter into a new chapter in India, and we've seen great success every country in the world that we've launched Prime, and we feel India is going to be no different.
So, yes, this is really to support both the customers that we have there in Italy and throughout Europe, and we'll continue to invest in the coming years.
",62.82,0.9723831
amazon,q3,2016,"We're also investing in digital content and additional Prime benefits, fresh location Prime Now. But by far the biggest individual thing is the investment in India that we continue to make and very excited about it, the initial reaction in India from both the customers and also sellers.
I guess when we think about the progression of margins in the second half versus the second half of 2015 and kind of the flat-lining of overall margin at this point excluding AWS, I guess should we think about this as being a temporary kind of plateau that will at some point resume once you start leveraging the fulfillment build-out?
Well we will continue to invest in the business where we are seeing significant customer traction.
Most of those are in North America but that compares to 14 last year and I would look, looking back the last time we had double-digit increase in fulfillment centers was in 2012 when we added 11 in the third quarter.
So we continue to build for high AFN, or Amazon Fulfilled Network demand, including both retail and FBA.
So what you're seeing essentially in the second half of this year is a step-up investment primarily around digital content and also the fulfillment center investment, but also things like Echo and Alexa which we're adding a lot of resources to, India and AWS as we add people there to support additional service, think (7:54) rapid growth in that business.
In the past, I think you've talked about how it takes time to kind of get the fulfillment centers to peak efficiencies, so with these new FCs opening, could you just talk about it?
On the AWS question, yeah, we continue to invest in AWS on behalf of our customers in addition to the technologies that make integrations easier that helps companies move from an on-prem or a hybrid IT environment into AWS.
So we're going to continue to do that, specifically things like the database migration tool that are helpful for customers when they move production databases from on premises to the cloud with virtually no downtime.
So yeah, were doing a lot of things to help make it easier for all customers to migrate to AWS.
And how big that, any way to help us quantify how big that already is to the revenue growth that you're seeing, particularly on groceries and any particular comments on fashion and apparel, same line of thinking?
Certainly a business where we continue to work on costs and profitability, but we are finding it's a very attractive service to our customers, which is what we're after.
So we continue to believe consumables, groceries are a key part of the offer to customers and we are playing with very different models to see which works and for what needs.
And Prime Now, we're also very happy with, although obviously the economics in that business are even tougher, but we do feel that our scale makes that possible because of the geographic footprint and how close we already are to customers.
We continue to work with brands to come on board and we're happy with the traction we're seeing with those brands.
Olsavsky - Amazon.com, Inc. To answer your question about was that part of investment.
Yes, this is certainly part of our investment but the large ramp, if you will, in investment that we're seeing from the back end of last year and also the first half of this year is more related to digital content and the build in our fulfillment network, which I've already discussed.
And the biggest issue you're trying to get at is having the most valuable products for holiday in the warehouse in the Prime space and not having the warehouse filled with things that may not sell until after the New Year.
But the things that we're seeing hit the P&L are the fixed and variable expenses that it takes to run the building and I think that's what Brian's pointing out most pointedly in terms of what is impacting the profitability of the second half.
Your question on fulfillment expenses, I can't extend the guidance into next year.
A follow-up on the FC question, and I guess more specifically it sounds like you have enough capacity in terms of fulfillment centers for the holidays, but also wondering what your comfort level is in terms of your shipping partners to manage those deliveries.
So yeah, we looking forward to a great holiday and that includes working with our shipping partners both in the U.S. and globally.
I guess when you look at fourth quarter guidance and you back out AWS, it suggests that margins are, on the core business, are going to be pretty down versus last year.
Yes. As far as the continuation of the investment into next year, I cannot give you much color on that today.
We are experiencing a ramp-up, if you will, in the second half of this year particularly tied again to AWS, or excuse me, the fulfillment center spend and also the video content spend.
We'll continue to invest in things that we believe enhance the customer experience, particularly the Prime experience.
We are honing the businesses that we're in and making them as efficient, as profitable as possible while also investing very pointedly and very wisely, we believe, in things that will enhance customer experience and create lasting businesses for us down the line.
The investment that we are seeing is a step-up versus what we have experienced in particularly the first half of this year and the last half, the second half of last year which I mentioned.
So we will try different delivery methods or pick-up points or ways of getting product to customers, but nothing specific to point out on the grocery side right now.
And as Brian pointed out earlier, our AFN unit, our Amazon fulfilled units, which include our first-party units as well as FBA units that go through our warehouses are continuing, are certainly higher than that 28%.
Darin Manney - Amazon.com, Inc. So thank you for joining us on the call today and for your questions.
Our results are inherently unpredictable and may be materially affected by many factors including fluctuations in foreign exchange rates, changes in global economic conditions and customer spending, world events, the rate of growth of the Internet online commerce and cloud services and the various factors detailed in our filings with the SEC.
It is not possible to accurately predict demand for our goods and services and therefore our actual results could differ materially from our guidance.
Our first question comes from Douglas Anmuth with JPMorgan.
Our next question comes from Gene Munster with Piper Jaffray.
Our next question comes from the line of Mark Mahaney with RBC Capital Markets.
Mark Mahaney - RBC Capital Markets LLC
Our next question comes from the line of Colin Sebastian with Baird Equity Research.
Our next question comes from the line of John Blackledge with Cowen & Company.
",59.47,0.78503
