Company,Quadrant,Year,Summary,Linguistic Complexity(Flesch Scores),Sentiment
amazon,q4,2016,"So yes, what you are seeing, John, is the continuation of the step-up investment that we saw in the second half of last year.
And then separately as it relates to just the video service, from a positioning standpoint in the market, how do you think about the unique aspects of the product that Amazon has relative to others in the market in terms of the aggregation tools that are being provided now where some of the value is being perceived longer-term?
Well, ultimately, I'll step back and say one of the main things we look out on Prime Video is customer usage patterns and in 2016 we had a doubling of Prime hours for video, music and reading.
I'll also point out that we rolled out the global Prime Video offer in the second half of last â or, excuse me, in Q4.
Yes, the investment did step up in the second half of last year, including marketing.
The offering in China that we have for consumers is also a great, trusted customer engagement.
We continue to say that, but we are very encouraged with what we've created with customers and sellers alike in India over the last few years.
We will continue to build our business there and continue to do a great job for both customers and sellers.
But we like the initial engagement we're seeing and the response from, again, both customers and sellers.
And then my whether question is whether you can shed any more light on the motivation to build out the air cargo hub in Cincinnati, understanding the need to support the growth of the core retail business, but also if this gives you more of an opportunity to build out direct connections to suppliers, for example, or a longer-term offer excess capacity or logistics as a service.
And, sorry, the second question is on the hub in Cincinnati â or excuse me, in Kentucky.
But the engagement is just like any other Prime benefit or investment that we have.
So it's a great, again, part of the flywheel in that, Echo and Alexa make the devices better and it builds engagement, not only with Echo and Alexa, but also with Amazon.
We continue to add Prime members and similar to the flywheel that Brian was just mentioning, that the FBA selection helps us with engaging customers and in particular the Prime program.
So we're very pleased with our customer engagement this year.
So as you point out, we've had Amazon Logistics deliveries in the UK for more years than some of our other countries and what we see is it gives us control of the shipment for a lot longer.
I think it's a great value to our customers.
But we test, we innovate, we think the bookstores for instance are a really great way for customers to engage with our devices and see them, touch them, play with them and become fans.
Olsavsky - Amazon.com, Inc. But I will say on â you're talking about the levels of engagement now that we're seeing versus what would be the long-term model over time.
So, we see a double benefit of the global Prime Video program, again both to amortize the investment in original content but also to show that original content to more and more people, because we think it's done really well.
We think it's won a lot of awards and we've worked with some â again some great, talented people.
Darin Manney - Amazon.com, Inc. Thank you for joining us on the call today and for your questions.
Our comments and responses to your questions reflect management's views as of today, February 2, 2017 only and will include forward-looking statements.
Additional information about factors that could potentially impact our financial results is included in today's press release and our filings with the SEC, including our most recent Annual Report on Form 10-K and subsequent filings.
Our results are inherently unpredictable and may be materially affected by many factors, including fluctuations in foreign exchange rates, changes in global economic conditions and customer spending, world events, the rate of growth of the Internet, online commerce and cloud services, and the various factors detailed in our filings with the SEC.
Our next question comes from Scott Devitt with Stifel.
Your next question comes from Justin Post with Bank of America Merrill Lynch.
Your next question comes from Heath Terry with Goldman Sachs.
We've been pretty clear that this business is all about creating new functionality for customers, giving price cuts and then working on the operating efficiencies.
The other data point I'll give you that affects our cost structure is our Amazon Fulfilled units, which is the combination of retail plus FBA, grew nearly 40% last year and that compares to our paid unit growth of 24% in Q4.
Our next question comes from Colin Sebastian with Robert W.
Our Amazon Fulfilled units, the amount going through our fulfillment centers and which essentially includes our first-party retail and our FBA sales and it grew nearly 40% over 2016.
Your next question comes from Douglas Anmuth with JPMorgan.
The next question comes from Mark Mahaney with RBC Capital Markets.
Just any sort of impact on what people with these Echo devices do that's different than Amazon customers that don't have them.
So I don't think I'm going to answer your exact question there on quantifying the retail sales through Echo devices.
Our next question comes from Brian Nowak with Morgan Stanley.
Our next question comes from the line of Jason Helfstein with Oppenheimer.
Our next question comes from Eric Sheridan with UBS.
Anthony DiClemente - Nomura Securities International, Inc. Thanks for taking my questions.
And then finally, just a question of do you need to aggressively partner with distributors, whether they be cable distributors or hardware device companies in order to get better distribution of the Amazon Prime Instant Video app and content to your customers?
",65.56,0.8242359
amazon,q1,2017,"Our comments and responses to your questions reflect management's views as of today, April 27, 2017, only and will include forward-looking statements.
The new rule requires excess tax benefits from stock-based compensation to be presented as an operating activity in the consolidated statements of cash flows.
Our first question comes from Justin Post with Merrill Lynch.
Our next question comes from Mark Mahaney with RBC Capital Markets.
Our next question comes from Brian Nowak with Morgan Stanley.
I guess it would be curious to hear how you think about the importance of an Amazon brick and mortar presence and how that fits into the long-term strategy?
Our next question comes from Ron Josey with JMP Securities.
We've had â customers migrated more than 23,000 data basis using the AWS Database Migration Service since that launched last year.
Our next question comes from Dan Salmon with BMO Capital Markets.
Brian, I had a couple questions about your growing advertising business.
And then second, I think it's fairly obvious why someone selling within the Amazon ecosystem would be interested in promoting on the platform, but maybe tell us a little bit about maybe over the long-term there are opportunities for sort of non-endemic advertisers within your platform.
Our next question comes from Douglas Anmuth with JPMorgan.
And the fulfillment centers I'll also say with the robotics technology tend to be more capital intensive than prior versions of warehouses, and then they generally have much better operating efficiencies and variable costs following their start-up.
Our next question comes from Heath Terry with Goldman Sachs.
Our next question comes from Colin Sebastian with Robert W.
Let me start with your middle question.
Let me step back and talk about international growth in general.
Our next question comes from Eric Sheridan with UBS.
So I'm not quantifying the Prime membership or commenting on the growth rates, other than to say it's been very strong and Q4 strength has continued into Q1.
Our results are inherently unpredictable and may be materially affected by many factors, including fluctuations in foreign exchange rates, changes in global economic conditions and customer spending, world events, the rate of growth of the Internet, online commerce, and cloud services and the various factors detailed in our filings with the SEC.
We just opened up Amazon Fresh in Tokyo last weekend, but also Prime Now. You saw other things like our business B2B business just opened up in the UK.
The other big influence is the same trends are happening in international with respect to FBA growth and the fact that our Amazon fulfill network, or the units we shipped, are growing at a much faster clip than our paid unit growth.
And then secondly on these â on the Echo devices, the Echo family, Alexa devices that are coming out, could you comment at all about what kind of impact you're seeing in terms of increased wallet or per share within households?
We think as engagement â as we pick up engagement with the devices, it helps the engagement with Amazon as a whole.
And the big picture is, again, as we've said customers â the things customers love can grow to be large, we'll have strong financial returns and they're durable and can last for decades.
Things like Prime Music, Prime Now, Amazon Fresh, all expanding globally.
We also have this trend going on in our fulfillment networks where strong FBA growth and high growth in Amazon fulfilled unit is resulting in a large increase in fulfillment capacity.
You're starting to see some of that show up in things like Amazon Go, our beta store that we have developed in Seattle, drones.
We use those technologies a lot in our internal businesses and we're also developing services for AWS customers.
But I think the general theme is there's a lot of investment in front of us that we're optimistic about, and we continue to ramp those investments.
So, particularly as it pertains to our fulfillment center networks, I think the biggest areas of efficiency right now are in our Amazon Robotics areas.
Brian, I think you mentioned the accelerating growth within AWS on new products and last year you added about 1,000.
You clearly see our â we break out very clearly our AWS segment revenue and operating income, and you'll also keep in mind that there's price decreases that are part of the business, and we're pretty public when we do those.
So that nearly 40% growth in Amazon fulfilled units last year, and the continuation of the strong growth higher than the paid unit growth that we see in 2017 is resulting in a lot of fulfillment center capacity.
Just curious if you'd say â have you made a lot of progress in terms of catching up with some of the fulfillment needs that you saw necessary in the business at the beginning of last year?
And then I know you just said that you're â it's still early days in terms of advertising, but there's a perception out there that over the last year or so that the company has sort of really begun to focus more on this business opportunity.
Our scale and number of customers, number of clicks, number of eyeballs, and new content â video content and other opportunities for advertising has really helped create some scale in that business.
We had a very clean holiday, and we think it worked well for both customers, Amazon and also for sellers â for FBA sellers.
We're not breaking out the specific growth rates for Prime, but certainly it â we like what we see in terms of the growth, and it's been consistent with what we have seen over the last quarter or so.
You talked a lot about the fulfillment centers, but could you update us on where we are in terms of rolling out Prime Now facilities and sorting centers?
Olsavsky - Amazon.com, Inc. Sort centers, right.
Olsavsky - Amazon.com, Inc. We're still growing that and we're happy with the progress in Prime Now and the service that â the value that it creates for Prime customers.
Darin Manney - Amazon.com, Inc. Thank you for joining us on our call today and for your questions.
",65.96,0.90041924
amazon,q2,2017,"Our results are inherently unpredictable and may be materially affected by many factors, including fluctuations in foreign exchange rates, changes in global economic conditions and customer spending, world events, the rate of growth of the Internet, online commerce and cloud services and the various factors detailed in our filings with the SEC.
The other dynamic is that, similar to last year, a large percentage of our new fulfillment centers are coming online in the second half of the year, a lot of them in Q3.
Other than that, can't give much more specifics except to say that the large investment areas remain the increasing fulfillment capacity to service the strong growth of the FBA business.
On your larger question about what the place of Amazon Fresh, likely Prime Now and some of our other efforts, I would say we believe there'll be no one solution, so we're experimenting with a number of the formats from physical pickup points in Amazon Go to online ordering and delivery to your door through Prime Now and Amazon Fresh.
So as you point out, the year-over-year difference is primarily driven by investments, what we were within the guidance range and we continue to invest in, as I said, fulfillment capacity and logistics services, digital video, our Echo and Alexa, Echo devices and Alexa platform India, the buildup at the AWS infrastructure, all the things I mentioned not to mention Prime Now and Amazon Fresh and Prime benefits.
Right now, what we're seeing is an accelerated growth rate in software engineers and also sales teams to support primarily AWS and advertising.
So, I saw firsthand the customer experience, I think, that's what we're seeing as a benefit to the physical stores right now.
Olsavsky - Amazon.com, Inc. So, yes, we've had numerous price decreases, and we continue to have that in the AWS business, both absolute decreases in service costs and also rolling out new services that may be cannibalizing more expensive other services that we provide.
What I can say, the biggest dynamic going on again is that Amazon fulfilled unit growth of nearly 40%, which was last year and carrying into this year.
We are matching that with just over 30% increase in square footage, and you're right, that does include some shipping sort centers and things that are incremental and new functions for us, if you will.
I just wanted to follow up on AWS, and just on the back of the price cut, obviously 1Q being the first full quarter, but it looks like 2Q, as Mark said, things did stabilize some.
On AWS, yes, we are seeing great customer adoption.
So the AWS revenue growth showed almost no change but the AWS operating margin was lower I guess than we've seen in, I don't know, six quarters or something like that.
And again, we like what we see and we'll continue to expand that and we'll be working very hard on making that not only a valuable Prime offering, a Prime benefit, but also a lower-cost operation as well.
I would just like to use that maybe as a springboard to talk a little bit about what you think the right mix is for how you sell in terms of self-service versus salespeople.
On operating margins internationally, I would step back and say a lot of the investments we're making in North America we're also making in international.
Prime benefits including Prime Video and remember we launched Global Video in Q4 of last year to 200 countries, Prime Now, Amazon Fresh, the general rise of FBA and added selection, both retail and FBA to make Prime more attractive, and the fulfillment and logistics costs that go with that, and the additional constant effort to reduce prices and accelerate shipping.
Darin Manney - Amazon.com, Inc. So thank you, Brian, and thank you all for joining us on the call today and for your questions.
We appreciate your interest in Amazon.com and look forward to talking to you again next quarter.
Our first question comes from line of Heath Terry with Goldman Sachs.
Or should we think about adding different modes such as pick up points and bricks and mortar as serving a distinct customer base or geared to reduce the cost bottleneck around home delivery?
May - Citigroup Global Markets, Inc. Could you characterize or maybe even quantify how much of the fulfillment infrastructure investment that you're making is kind of incremental, is geared towards handling growth and sort of the existing business and infrastructure versus expanding your capabilities in fulfillment, like adding more inbound or last mile and/or from entering new international markets where you need to invest ahead of growth versus just sort of keeping up and maintaining growth within sort of your existing footprint?
Our usage in all of our large services are actually accelerating and they're growing at a rate higher than our revenue growth.
Our next question comes from Mark Mahaney with RBC Capital Markets.
Our next question comes from Brian Nowak with Morgan Stanley.
Let me start with your second question on the subscription revenue.
Our next question comes from the line of Dan Salmon with BMO Capital Markets.
Our next question comes from line of Eric Sheridan with UBS.
Our next question comes from line of Brian Fitzgerald with Jefferies.
Jason Helfstein - Oppenheimer & Co., Inc. Thanks for taking my question.
",53.24,0.84837824
amazon,q3,2017,"Our first question comes from the line of Justin Post with Merrill Lynch.
Maybe comment a little bit on the unearned revenue growth on the balance sheet, why it might be slower than the past?
Our next question comes from the line of Mark Mahaney with RBC Capital Markets.
Revenue growth was the same as Q2, and now we're at an $18 billion run rate, whereas last quarter when I had this call, we were at $16 billion, so very pleased with the customer response in the AWS business as well.
Our next question comes from the line of Brian Nowak with Morgan Stanley.
Our next question comes from the line of Eric Sheridan with UBS.
Our next question comes from the line of Douglas Anmuth with JPMorgan.
In particular, there's a lot of talk now about potentially using Whole Foods stores for a physical pharmacy presence and also that you've perhaps gotten approvals across multiple states in that category.
And we think we'll be also developing new store formats and everything else just as we talked about in the past before Whole Foods.
Our next question comes from the line of Mark May with Citi.
Our next question comes from the line of Ross Sandler with Barclays.
Our next question comes from the line of Heath Terry with Goldman Sachs.
And particularly how the company and management thinks about entering more regulated businesses over time, how you would approach that versus a standard category that you might go into or maybe again knowing you can't comment on rumors, how you have approached that in the past or in other markets.
Our next question comes from the line of Scott Devitt with Stifel.
Our next question comes from the line of Jason Helfstein with Oppenheimer.
Our final question comes from the line of Ron Josey with JMP Securities.
We launched month-to-month Prime last year and if you think about how that works, customers are paying $10.99 per month as they go, so there's less that's deferred.
But if you step back on Whole Foods, again, I think we've had busy months since we've joined forces, offering lower prices on a range of key grocery items in the stores, launching the Whole Foods private label products on Amazon, the technical (06:07) work to make Prime the Whole Foods customer rewards program, and we'll have that coming out in the future.
A lot of the building blocks that we've been working on, all the Prime benefits, advancements in free shipping offers or faster shipping offers, the Prime benefits would drive engagement, of course, adding selection, adding Fulfilled by Amazon partners and the selection that they bring.
I think over time, you'll see more cooperation and working together between AmazonFresh, Prime Now, and Whole Foods as we can explore different ways to serve the customer.
In this line item, is certainly the fees associated with Amazon Prime and also it's where a lot of our subscription services for digital music, digital video, audiobooks, e-books, so there's some moving parts in there.
And again, on the other subscription services, music especially, it works just so well with our Echo device that we're seeing a lot of growth in that area as we increase the number of Echo devices and customers using the Echo devices.
We continued to hire a lot of sales reps and it's tied directly to our major investment areas of AWS, Prime Video and devices.
As I said, there will be a lot of work together between Prime Now, AmazonFresh, Whole Foods, Whole Foods products on the Amazon site, Amazon Lockers at the Whole Foods stores.
So, we're really excited about that and I think working together, will bring our different strengths to the table and really be able to build on behalf of customers.
And in terms of the increased losses in the international retail segment of the business, can you provide some color around how much of that's being driven by Amazon launching into new markets, which I know you continue to do, versus investing more heavily in existing markets?
We had the first Prime Day there this year, Prime Music, Amazon Business is also expanding in India.
In video, if you remember in Q4 of last year, we launched Prime Video in over 200 countries globally, continue to build up not only the offerings, but also the engagement that we see from those Prime customers.
I understand you can't comment on rumors one way or the other but curious, as you think about categories like health care and, obviously, you guys are already in health care to some degree through Amazon Business, can you give us a bit of a status update on what you do have out there now?
It's because the video business is having great results with our most important customer base, which is our Prime customers.
We're seeing the engagement go up year-after-year in video and also music and a lot of the other Prime benefits.
So Whole Foods, I think I mentioned this earlier, but we definitely see commonality and overlap with the Whole Foods business as well as Amazon in total, but specifically Prime Now and also AmazonFresh.
On the ad supported question, I think what you've seen to-date is really particularly as you're looking as a customer, as a Prime Video member and watching content, we view that as you've paid into that service and able to watch those shows ad free.
Just wanted to ask about delivery and just over the last several months, we've seen a lot of announcements and products around delivery options between Lockers, the testing of the Kohl's partnership, Whole Foods obviously, Amazon Key came out recently, just wanted to better understand this investment.
",59.77,0.74752873
