Company,Quadrant,Year,Summary,Linguistic Complexity(Flesch Scores),Sentiment
amazon,q2,2015,"The increase in capital expenditures and capital leases reflects additional investments in support of continued business growth due to investments in technology infrastructure, the majority of which is to support AWS and additional capacity to support our fulfillment operations.
You clearly had a lot of things working well in the quarter, but maybe just focusing in on AWS, which seems to be quickly emerging as kid of your largest contributor to operating income.
Can you maybe provide a little more color on what drove the acceleration and just the overall growth in the business?
If you could talk a little bit about the addition of new customers versus average spend per customer and I think in the past you've talked about what unit growth was for AWS?
I wanted to know â you've talked a little bit about that market in the past â whether there was any update there in terms of how you think about approaching the market and the level of investments that might be needed to compete in the market?
So we're very happy, very encouraged early on with what we've seen in the ramping of the business, the level of invention going on for both customers and sellers.
We are also seeing a great efficiency in the business on a cost basis.
We are continuing to drive operational improvement in every business that we are in, but we are also investing in large opportunities that are in front of us, particularly in Marketplace Prime and AWS.
He said we're going to look for things that are important to customers, customers love them, businesses that can grow to be a large size that can generate a high return on invested capital and are durable and can last for decades.
A lot of it is the top-line growth, but it's also a lot of the efficiency we're seeing, particularly on the fulfillment and marketing lines, which for the whole company were flat year-over-year on a percent of revenue basis.
Just two things I wanted to ask, First on Prime Day. Brian, if you could give a little more color there on the early takeaways that you have and then also perhaps more importantly how you think that sets Amazon up for the back-to-school season and then also the holidays later in the year?
We continue to look for smart, innovative people who want to build on behalf of customers and â but this particular quarter is colored a bit by the operations growth.
We are looking for return on invested capital, free cash flow, and happy customers in the space.
I will also say that Amazon is one of the primary large customers of AWS so we see it in the consumer side of the business as well, although that's not included in AWS revenue.
We are really following the model of giving our customers as many choices as possible and letting them choose whether they want to buy first-party or third-party and I think we're working really hard to make sellers succeed on the platform.
Brian touched on the success that our FDA sellers had with Prime Day, but we see FBA as a tailwind for third-party business in general.
On the price reduction question, we've got a long track record of driving costs out of the business and you can certainly see where we've even done that over the last several quarters if you look at the margins in AWS.
As I said earlier we benefit from the efficiency gains of the AWS business on the Amazon site as well.
We look to increase the leverage of our fixed assets, particularly our fulfillment centers and the throughput of the fulfillment centers, and just generally getting inventory closer to customers as we add and expand warehouses in the sort centers that we added primarily last year.
So like I said, a little early for the update at this point but something we're looking at and something the team's working really hard on.
In the Retail business obviously a lot of variables driving growth there, we're seeing higher Prime membership levels for one, but I wonder how much of that growth you can also break down by some other factors; for example, we're seeing a notable increase in selection across longer tail categories?
So, Brian, I know you guys don't like to provide guidance beyond the next quarter but philosophically if we go back a few quarters you've characterized 2015 as a year where you believe that some of the heavier investments made in prior years should start to benefit and pay off.
And we're see â we're clearly seeing that in AWS and in North America retail and it looks like you're still investing heavily on International retail.
And then a few other things you may have seen in our press release today, the launch of Mexico which we are excited about and Amazon business.
We are definitely working for operational efficiencies in the business that we're in.
Brian, just to follow-up on the India question earlier.
And I think as Brian mentioned, India is a country that we're doubling down on based on the success we've seen there so far.
We drive a lot of repeat business with things like Prime Pantry and Subscribe and Save and others.
Second, there have been a couple questions about shipping but most notable is that we had a couple price increases from the majors hit at the beginning of the year and it seems like you're costs are coming down.
On the FCs and whether we would expand or build new, I think we are looking to always get the most out of the fulfillment centers that we have and as we need new facilities we place them closer and closer to customers so that can have its benefits as well, but not much more to add on that one.
The following discussion and responses to your questions reflect management's views as of today, July 23, 2015 only and will include forward-looking statements.
Additional information about factors that could potentially impact our financial results is included in today's press release and our filings with the SEC including our most recent annual report on Form 10-K.
As you listen to today's conference call we encourage you to have our press release in front of you which includes our financial results as well as metrics and commentary on the quarter.
Worldwide revenue grew 20% to $23.18 billion, or 27% excluding the $1.39 billion unfavorable impact from year-over-year changes in foreign-exchange.
Consistent with prior periods we do not allocate two segments, our stock-based compensation, or the other operating expense line item.
Media revenue grew 6% to $2.62 billion or 7% excluding foreign-exchange.
North America segment operating income increased 113% to $703 million a 5.1% operating margin.
Excluding the $9 million favorable impact from foreign-exchange, North America segment operating income increased 111%.
Media revenue decreased 12% to $2.09 billion or increased 3% excluding foreign-exchange.
EGM revenue grew 10% to $5.43 billion or 31% excluding foreign-exchange.
EGM revenue grew 10% to $5.43 billion or 31% excluding foreign-exchange.
International segment operating loss includes $89 million of unfavorable impact from foreign-exchange.
Amazon Web Services segment operating income increased 407% to $391 million, a 21.4% operating margin.
Excluding the $71 million favorable impact from foreign-exchange, AWS segment operating income increased 314%.
Consolidated segment operating income increased 166% to $1.07 billion or 4.6% of revenue, up approximately 250 basis points year-over-year.
Excluding the $9 million unfavorable impact from foreign-exchange, CSOI increased 168%.
Inventory increased 12% to $7.47 billion and inventory turns were 8.9 turns down from 9.1 turns a year ago as we expanded selection, improved in-stock levels and introduced new product categories.
Our guidance further assumes that we don't include additional business acquisitions, investments, restructurings, or legal settlements, record any further revisions to stock-based compensation estimates and if foreign-exchange rates remain approximately where they've been recently.
This guidance anticipates approximately 620 basis points of unfavorable impact from foreign-exchange rates, GAAP operating income or loss to be between $480 million loss and $70 million of income compared to a $544 million loss in the third quarter of 2014.
Our next question comes from Justin Post with Merrill Lynch.
And our next question comes from Mark Mahaney with RBC Capital Markets.
Our next question comes from Brian Nowak with Morgan Stanley.
Our next question comes from Heath Terry with Goldman Sachs.
Our next question comes from Youssef Squali with Cantor Fitzgerald.
Your next question comes from Ron Josey with JMP Securities.
Our next question comes from Brian Pitz with Jefferies & Company.
Thank you for joining us on the call today and for your questions.
",54.66,0.85231483
amazon,q3,2015,"As you listen to today's conference call, we encourage you to have our press release in front of you, which includes our financial results as well as metrics and commentary on the quarter.
These capital expenditures and capital leases reflect additional investments in support of continued business growth due to investments in technology infrastructure, the majority of which is to support AWS and additional capacity to support our fulfillment operations.
As a reminder, in the first quarter, we changed our reportable segments to report North America, International and Amazon Web Services.
The first question, Brian, International retail growth continues to improve, and I was wondering if you can just talk through some of the dynamics there, understanding that consumption tax in Japan comped, you have some newer markets where you have physical infrastructure now in Europe, and then also the dynamics in India and China as contributors.
I'll remind you that Prime Day was a global event, so we saw that is International as well, and it was a great event for â a great day for customers, Amazon and sellers alike.
So like AWS, the model remains early days and we enjoy leading this business and customers responded well and we believe we are adding new services and features at a rate faster than many others.
And if you could give us a sense of what CapEx for this segment of the business looked like in the quarter, and the rate of growth there would be helpful.
This is a young and rapidly growing business, and as you've seen looking backwards, certainly growth rates and margins and capital expenditure timing can be bumpy.
We're excited about the potential there, and really the team's focused on just keeping their heads down and continuing to accelerate the pace of innovation to try to continue to grow the functionality gap we think we offer.
And so, on the AWS side, we've got investment going on around the world, certainly additional servers to support the strong growth we have.
And some of the expense for things like data centers or new regions can be a little lumpy, and we've mentioned a couple of new regions we're working on throughout the world.
On EGM growth, I won't call out any particular categories, but it is a direct reflection of our efforts to grow selection, both our retail selection and also our third party, particularly FBA which is also Prime eligible and then just the responsiveness of our customers, especially our Prime customers to the EGM product line.
So we are very encouraged, as I said last quarter in India, and continue to invest there very heavily.
So we're continuing to work on some of the items we've been talking about for a couple of quarters now.
I think Amazon Global Store continues to expand the selection there.
We added about another 400,000 items to that store this quarter and continue to focus on using our global network of vendors to be able to get those products to customers.
Can you call out in terms of the 3P business what you're seeing in terms of third party sellers maybe needing to make more and more of their goods Prime eligible?
So, we have seen growth in FBA, it increases our Prime fast track eligible selection which we like and customers like.
We've been working on our network for about 20 years to be able to enable some of the really fast delivery with things like Prime Now. But at this point, we're in a relatively small list of cities, but it's expanding pretty fast.
So I just wanted to ask, is that a legitimate question do you think or are you now at a point of scale and market share and maturity that you can sustainably manage the heavy investment while still delivering material profit?
We've already talked about India but domestically we are, globally, we are investing very heavily in our Prime platform, both in North America and International and that includes video content and original content, Prime Music.
So there is a lot of investment going on and there will be continued, especially related to Prime.
The good thing about 30% revenue growth is it gives you a lot more cost to work on as well.
And then the second one, just curious for comments on International Prime sub growth.
We're not going to update our Prime subscription growth beyond what we said last year at the end of last year, which last year in a year when we raised prices early in 2014.
We continue to launch other Prime benefits, Amazon Pantry in Japan and Germany this quarter.
We launch Prime Now in the U.K. So, it's very similar to the U.S. story, potentially time lagged a bit, but we are seeing the same customer adoption and impact on growth rates.
Now, at this scale I know with the 50% plus growth rates that you just mentioned, if you roll the clock two or three years, one can see Prime penetration in markets like the U.S. starting to saturate as there are just so many homes in the country.
We think it's an interesting part of the selection offer for Prime and it's, in many ways, something that we can do that others can't, because it's a natural evolution of our 20-year effort to grow our fulfillment center network and our scale quite frankly makes it possible to even offer this to customers.
We think we have â we're attractive both to customers and to sellers and we like our position.
So continuing to work on Prime.
We continue to see really strong usage growth across the board, and it's coming from customers of all sizes.
And then the second question is North America and EGM growth accelerating again this quarter.
Worldwide revenue grew 23% to $25.4 billion, or 30% excluding the $1.3 billion unfavorable impact from year-over-year changes in foreign exchange.
Excluding customers who only had free orders in the preceding 12-month period, worldwide active customers were approximately 272 million, up from approximately 244 million in the comparable prior-year period.
North America segment operating income includes $11 million of favorable impact from foreign exchange.
EGM revenue grew 14% to $5.9 billion, or 32% excluding foreign exchange.
International segment operating loss includes $64 million of unfavorable impact from foreign exchange.
AWS segment operating income includes $78 million of favorable impact from foreign exchange.
Consolidated segment operating income was $993 million or 3.9% of revenue, up approximately 460 basis points year-over-year.
Our guidance further assumes that we don't conclude any additional business acquisitions, investments, restructurings or legal settlements, record any further revisions to stock-based compensation estimates, and that foreign exchange rates remain approximately where they've been recently.
This guidance anticipates approximately 340 basis points of unfavorable impact from foreign exchange rates, GAAP operating income to be between $80 million and $1.28 billion compared to $591 million in the fourth quarter of 2014.
We anticipate consolidated segment operating income, which excludes stock-based compensation and other operating expense to be between $700 million and $1.9 billion compared to $1.04 billion in the fourth quarter 2014.
Our first question comes from Scott Devitt with Stifel Nicolaus.
Our next question comes from Mark Mahaney with RBC Capital Markets.
Our next question comes from Eric Sheridan with UBS Investment Research.
Our next question comes from Douglas Anmuth with JPMorgan.
Our next question comes from Brian Nowak with Morgan Stanley.
Our next question comes from Neil Doshi with Mizuho Securities.
Our next question comes from Aaron Kessler with Raymond James.
Our next question comes from Brian Pitz with Jefferies & Company.
Our next question comes from Ron Josey with JMP Securities.
Our next question comes from Youssef Squali with Cantor Fitzgerald.
Our last question comes from John Blackledge with Cowen & Company.
",56.39,0.7929492
amazon,q4,2015,"These capital expenditures and capital leases reflect additional investments in support of continued business growth, due to investments in technology infrastructure, the majority of which is to support AWS, and additional capacity to support our fulfillment operations.
Fulfillment, marketing, technology and content and G&A combined was $9.7 billion or 27.1% of sales, up approximately 100 basis points year-over-year.
As a reminder, in the first quarter we changed our reportable segments to report North America, international, and Amazon web services.
North America segment operating income was $1 billion, a 4.7% operating margin, compared with $733 million in the prior year period.
Excluding the $1.1 billion year-over-year unfavorable foreign exchange impact, revenue growth was 22%.
In the Amazon Web Services segment, revenue grew 69% to $2.4 billion.
Amazon Web Services segment operating income was $687 million, a 28.5% operating margin, compared with $240 million in the prior year period.
Did we see more aggressive promotional activity and maybe talk about how you tried to work that to continue to drive the Prime number of members going forward?
Can you help give us a sense as to maybe what we're trying to accomplish with that, if it's defensive to protect your service to your existing customers or if you're looking to maybe start new businesses with those assets?
On gross margin, I would - first I'll caution you and say, we would encourage you to look at free cash flow, which was â grew at minimum of $4 billion on each of the metrics that we point out and our profit which was up 88% year-over-year.
And the operational improvements, excuse me, the gross margin, operating margin year-over-year that we've seen in the AWS business has been heavily driven by operating efficiencies, both purchase reductions and purchase prices and also efficiency in driving greater utilization of the assets that we have.
So very, very pleased with the critical acclaim to the Amazon Studios content and we've got a lot of new content coming out this year.
So it's still early, but we're encouraged and we think we're creating some value, a lot of value for our business customers.
I think you added well over a billion in revenue year-on-year in the quarter, but from a CSOI perspective, you really didn't see any improvement there.
I just wondered if you could unpack that a little bit and give us a sense of, you know, what profitability looks like maybe in some of your more mature, established countries and regions, relative to the investments you were making in other countries, so that we can kind of get a better picture of what's actually going on under the hood there?
And then second, last quarter, and I don't want to misquote you, but you said something along the lines of being able to invest as you'd like and also deliver good profit and that the pendulum wouldn't swing as far perhaps as it has in the past.
We didn't break it out by segment, but we said that Prime Day contributed 200 basis points to our Q3 run rate, revenue growth rate.
As I said in Prime, the Prime platform, Prime features for customers, expansion for fulfillment capacity as we build out to support 26% unit growth in Q4, for instance and much greater FBA share, and not to mention all the investments in AWS, we are constantly looking for cost efficiencies and fixing variable productivity.
We've heard the comments about the number of availability zones that are being launched this year, which is obviously about, a big part of driving incremental capacity in that business and just trying to balance those, think about how we should balance those three things?
Most of our capacity and capital and capital leases in AWS is to service existing regions and existing customers demand growth.
On a dollar basis, we continue to grow â we saw the greatest growth year-over-year and quarter-over-quarter and, again, we continue to invent, now with our price, we continue to innovate on behalf of customers and see great customer response.
In terms of expectations, I think we were pleased with what we saw this Q4 and, you know, if you look at what we gave for guidance, we were in the upper half of the range there for revenue.
And if you look at some of our new offerings like Prime Now that's available through a mobile app and very convenient for customers.
In lieu of that, can you comment on whether 4Q saw higher than usual costs for streaming content compared to other quarters in the year?
So your question about the AWS margins, that business as they continued to learn and as we continue to invent and get better at designing and operating the infrastructure and assets, we have been able to drive costs out of that business.
There's also an FX tailwind in there as well, which I think was about $60 million this quarter, which would contribute on a year-over-year basis, which really arises because we're largely priced in dollars, but have assets with local currency costs throughout the world.
I want to just quickly revisit the margin pendulum question and some of your comments, as you mentioned that to kind of expect it to ebb and flow.
On the speed of delivery, this is Phil, you know, all I can say is the customers love the service.
The following discussion and responses to your questions reflect management's view as of today, January 28, 2016 only, and will include forward-looking statements.
Trailing 12-month free cash flow less lease principle repayments increased to $4.7 billion, up from $529 million.
Excluding customers who only had free orders in the preceding 12-month period, worldwide active customer accounts were approximately 280 million, up from approximately 254 million in the comparable prior year period.
Media revenue grew 11% to $3.9 billion or 12% excluding foreign exchange.
North America segment operating income includes $6 million of favorable impact from foreign exchange.
Media revenue decreased 3% to $3.3 billion or increased 5% excluding foreign exchange.
EGM revenue grew 19% to $8.5 billion or 31% excluding foreign exchange.
International segment operating income includes $47 million of unfavorable impact from foreign exchange.
AWS segment operating income includes $60 million of favorable impact from foreign exchange.
Revenue increased 20% to $107 billion or 26% excluding year-over-year changes in foreign exchange.
North America revenue grew 25% to $63.7 billion or 26% excluding year-over-year changes in foreign exchange.
International revenue grew 6% to $35.4 billion or 21% excluding year-over-year changes in foreign exchange.
Consolidated segment operating income was $4.5 billion or 4.2% of revenue, up approximately 220 basis points year-over-year.
Consolidated segment operating income was $4.5 billion or 4.2% of revenue, up approximately 220 basis points year-over-year.
Our guidance further assumes that we don't conclude any additional business acquisitions, investments, restructurings or legal settlements, recording further revisions to stock-based compensation estimates, and that foreign exchange rates remain approximately where they have been recently.
This guidance anticipates approximately 130 basis points of unfavorable impact from foreign exchange rates.
This includes approximately $600 million for stock-based compensation and other operating expenses net.
Our next question comes from the line of Colin Sebastian with Baird Equity Research.
Our next question comes from the line of Ken Senna with Evercore ISI.
Hi. So lot of headlines around Amazon's activity at Sundance I just was hoping you could maybe expand once more on the video strategy and specifically are you seeing an inflection in Prime Video usage.
Our next question comes from the line of Mark Mahaney with RBC Capital Markets.
Our next question comes from the line of Heath Terry with Goldman Sachs.
Let me work backwards from your footprint question or comment.
Our next question comes from the line of Kerry Rice with Needham & Company.
The next question comes from Brian Pitz with Jefferies.
Our next question comes from the line of Gene Munster with Piper Jaffray.
Our next question comes from the line of Justin Post with Bank of America Merrill Lynch.
Our next question comes from the line of Ron Josey with JMP Securities.
Our final question will come from John Blackledge with Cowen & Company.
",55.68,0.71392435
