Company,Quadrant,Year,Summary,Linguistic Complexity(Flesch Scores),Sentiment
amazon,q4,2018,"Joining us today to answer your questions is Brian Olsavsky, our CFO.
Additional information about factors that could potentially impact our financial results is included in today's press release and our filings with the SEC, including our most recent annual report on Form 10-K and subsequent filings.
Our first question comes from the line of Justin Post with Merrill Lynch.
And then secondly, just if you could remind us or help us understand the Prime accounting change impact on subscription revenues in Q4?
Our next question comes from the line of Mark Mahaney with RBC Capital Markets.
Can you discuss what may have driven that and how to think about retail gross margins going forward?
Our next question comes from the line of Heath Terry with Goldman Sachs.
Our next question comes from the line of Brian Nowak with Morgan Stanley.
Iâm sorry I skipped over that gross margin question earlier, but yeah, gross margins were well up 180 basis points year-over-year, were not up as much as prior quarters.
Our next question comes from the line of Colin Sebastian with Robert W.
Our next question comes from the line of Lloyd Walmsley with Deutsche Bank.
Our next question comes from the line of Eric Sheridan with UBS.
Our next question comes from the line of Jason Helfstein with Oppenheimer.
Our next question comes from the line of Dan Salmon with BMO Capital Markets.
Thanks for joining us on the call today and for your questions.
I guess I'll ask about units, 14% in the quarter, just, how do you feel about the overall unit growth here, given that the growth was higher last year in the 20s and do you think there are some investments you can make in other areas to kind of reaccelerate that going forward?
Just on the second question on the subscription services, weâd said on the last call, you probably remember, related to the adoption of the accounting standards update and revenue recognition policies that was impacting our results in a number of areas in 2018.
And on unit deceleration, I think the unit numbers more and more require some interpretation, because it doesn't include the -- some of our fastest growing areas, the things like, as Dave mentioned, subscription services, AWS, advertising, Whole Foods units are not in that number.
Just comment a little bit on the international revenue outlook and any commentary on India and whether you think there's a material impact on your business?
Headcount only grew 14% year-over-year, but the areas that were growing in that mix were things like technology teams, device areas, AWS, especially sales and marketing.
Brian talked a little bit about it before, but pleased with the holiday season, both from sort of a first party side, but also sellers continuing to do well.
When I try to back out the impact factors like Whole Foods, the advertising accounting change and other factors, what I see is stable and pretty healthy revenue growth for the retail segment, but a slowdown in Q4 from what seems to have been, in more recent quarters, meaningful gross margin expansion in the retail segment.
And then on capital, especially infrastructure capital, if you use the capital lease slide as maybe an indicator for what we have invested into our AWS business to support infrastructure and global expansion, that number grew 10% last year, when it had grown 69% in 2017.
Anything to read into that about sort of what your expectations are for growth in those businesses, seeing that reacceleration after the deceleration that we saw over the course of at least the first three quarters of last year.
I still think the 17% is a low number for us, when you talk about the -- supporting the AWS business that's still growing in a very high clip and a very strong and healthy growth in FBA and customer demand and our expansion into new countries, both with AWS and also with our core consumer business.
Can you just talk to any of the puts and takes we should know about from a gross margin perspective in the fourth quarter and then that other line that I think includes the advertising business, can you just help us, any help at all on the growth of the advertising business or the impact of any of the accounting changes in the quarter?
In the quarter, looking backwards, not considering India and the impact going forward, but the international growth accelerated, so I was curious any particular regions or product categories to call out, especially given some of the weakness in the UK?
We generally work to change the fees to make sure that the incentives are strong on both sides and we continue to have a healthy growth in third party.
And then just on your second question around advertising, if you look at the other revenue, the growth rate decelerated some.
On your comment or question on transportation, we do continue to expand our Amazon logistics and delivery capability and it also matches up with our faster ship speed that we're seeing for Prime members as well.
",59.47,0.8623332
amazon,q1,2019,"Our results are inherently unpredictable and may be materially affected by many factors, including fluctuations in foreign exchange rates, changes in global economic conditions and customer spending, world events, the rate of growth of the Internet, online commerce and cloud services, and the various factors detailed in our filings with the SEC.
Again, as I mentioned last quarter, it is a measurement, excludes a lot of our fastest growing businesses, things like AWS, advertising, subscription services, which cannibalize the unit calculation, things like Kindle Unlimited and Amazon Music Unlimited.
So you remember last quarter, I made the point that 2018 saw lower growth in some of our key cost areas.
We're able to do this, because we spent 20 plus years expanding our fulfillment and logistics network, but this is still a big investment and a lot of work to do ahead of us.
And just to clarify, to give a little more information, we have been offering, obviously, faster than Two-Day Shipping for Prime members for years, one day, same day, even down to one to two hour delivery for Prime Now. So we're going to continue to offer same day and Prime Now selection in an accelerated basis.
Our engagement in video benefit - excuse me, Prime benefits, shipping, hours watched on video, hours listened to on music, all of them are trending in the right direction and continue to get more and more sticky.
The advertising business saw what looks like a little bit of a step-down again in Q1 versus Q4.
So we're very - excuse me, the other point I'll make is just like last quarter, I'll remind you that the physical stores revenue is principally Whole Foods revenue, but it excludes the online ordering component where people order on the Prime Now app and it's delivered to them.
So last quarter, I told you that our growth in store sales, including both shopping and also online deliveries, was closer to 6% in Q4, and it's a similar number in Q1.
And then just a follow-up, just to return to the $800 million investment to improve one-day shipping, it sounds like that investment is underway already and that - in noting that it'll help contribute to the high-end of the guidance this quarter, it sounds like the timing of that is fairly quicker.
I would say that while our 20-year head start in investments in logistics and fulfillment capacity and partner networks that we've built are helping us, we also do have a network that is tuned to two-day delivery right now, principally for two-day delivery.
So we do need to build out more one-day capacity along with our transportation partners, but we're moving quickly and we've got a good head start.
So again, we feel like if we work on the inputs on this business and continue to grow traffic to the site, we will have a good outcome in the advertising space.
In the shareholder letter, Jeff wrote third-party sellers are kicking our first-party butt, and we read through that, but as we kind of look at the trending and the pacing of the 3P business, you can see a little bit of a deceleration in the 3P sellers services line and then 3P unit slowdown might suggest that the third-party GMV expansion may not be happening quite as fast.
So again, the sellers are as important to us as anything for servicing the customers' need for price selection and convenience.
The elements I just talked about of investment, further investment in one-day shipping is directly going to be a cost that we bear and it's also going to be a direct benefit to sellers as well as the Prime eligible selection in our warehouses.
Just coming back to the Prime one-day delivery, will it be available to most of the U.S. by the holidays or by the end of the year?
And I think you had about 100 million items available for two-day delivery, Prime delivery.
Just on the grocery side of it, as you mentioned, Brian talked a bit about the Whole Foods Market growth over 500 stores, 75 metros with delivery capability, so continuing to grow that out.
And on the numbers, $800 million for the quarter, how should we think about that ramping into the back half of the year?
The operating margin has also expanded in that time period by 320 basis points as a result of a lot of the good work on infrastructure and efficiencies that I talked about earlier in the call, because this is against a backdrop of a very large expansion of our tech teams and our sales teams that supports this business.
We're really going to have to see how it goes this quarter, both on our pace of selection addition and expansion of one-day, and let you know probably at the end of the quarter.
I guess somewhat along those lines or at least along the lines of growth, we saw CapEx spending and investment in capital leases decelerate to the lowest rate that it's been in several years, maybe even the lowest rate ever.
I'm sure that's not representative of what you expect growth to look like.
The business in China is going really well and we continue to see strong growth there.
And, Brian, you talked about record Prime sub-growth last year.
Joining us today to answer your questions is Brian Olsavsky, our CFO; and Dave Fildes, Director of Investor Relations.
Additional information about factors that could potentially impact our financial results is included in today's press release and our filings with the SEC, including our most recent annual report on Form 10-K and subsequent filings.
It's not possible to accurately predict demand for our goods and services, and therefore, our actual results could differ materially from our guidance.
Our first question comes from the line of Mark Mahaney from RBC Capital Markets.
Thanks for your questions.
Our next question comes from the line of Doug Anmuth from J.P. Morgan.
Our next question comes from Eric Sheridan from UBS.
Our next question is from Dan Salmon from BMO Capital Markets.
And under that new guidance, we capitalize production cost for original video content.
We're now over $30 billion annualized run rate, 42% FX-neutral growth and $2 billion more of revenue this Q1 versus last Q1.
Our final question will come from Brian Nowak from Morgan Stanley.
Thanks for taking my question.
Thanks for taking my question.
",61.09,0.7871757
amazon,q2,2019,"Joining us today to answer your questions is Brian Olsavsky, our CFO; and Dave Fildes, Director of Investor Relations.
Actual results may differ materially.
Itâs not possible to accurately predict demand for our goods and services, and therefore our actual results could differ materially from our guidance.
Our first question is coming from the line of Brian Nowak with Morgan Stanley.
Our next question comes from Heath Terry with Goldman Sachs.
Are there any products or sort of product areas AI obviously being one that's been a major initiative for you that you're seeing particular either outside growth or under growth relative to the overall business that you would call out?
Our next question comes from Jason Helfstein with Oppenheimer.
Our next question comes from Youssef Squali with SunTrust.
Our next question comes from Mark Mahaney with RBC Capital Markets.
Our next question comes from Ross Sandler with Barclays.
Your comment on revenue growth differential, I mean there's so many different factors going on in every country that's hard to compare North America to international.
Our next question comes from Mark May with Citi.
Our next question comes from Colin Sebastian with Robert W.
Our next question comes from Brent Thill with Jefferies.
Our final question will come from Eric Sheridan with UBS.
And then sort of the opposite question on AWS, which has slowed a little bit can you just talk about some of the puts and takes in the AWS revenue growth this quarter versus the prior Q?
So as you can tell, we've been pretty transparent with our AWS revenue and income numbers we've been breaking it out for 2015 and we're very happy with the growth in absolute dollar terms and we're seeing a pick up from customers and their usage, their increased pace of enterprise migrations, increased adoption of our services especially our machine learning services.
On your question about one-day, let me update you on that, because obviously that was a big topic of conversation last quarter and you can see that it's starting to show up in our results in Q2.
We expect to see continued ramp of the one-day selection availability for the next few quarters both in North America and international.
The initial two-day Prime shipping offer that we launched many years ago, the great expansion of our network to include FBA merchants and capacity for them and more recently, the first steps to increase one-day and same day although on a much smaller scale.
We have seen lower ASP generally in Q2, higher unit growth versus revenue growth in North America and we could be that we're mixing into some lower ASP items as we launch one-day, but we haven't drawn that total conclusion yet.
In particular on Prime Day, I think you'll see that we had -- over in the press release, we had more than $2 billion of products were bought from small and medium-sized businesses.
So, we think there's a lot of shared purpose there and a good quarter where we're looking forward to the Diwali holiday this year.
And the other thing I would point out on the trajectory is that, we're just getting started in international and most of that work is ahead of us although the speed that tick up a bit in Q1 -- excuse me Q2 but -- and will do even more so in Q3 in future quarters.
Hey Brian could you talk a little bit about the elasticity you're seeing -- you expect to see in international markets with the rollout of one-day?
But we think the biggest elasticity is probably in North America where the standard has been 2-day shipping for Prime.
I do want to add one point though because when we talk about operating income in both in Q2 and Q3 and we talk about the cost and penalty of one-day, I would like to highlight there's some other investment areas that are certainly going on here.
So yes -- sorry, the operating margin in AWS, just like the revenue rate it's such a rapidly growing business with different timing of investments and global expansion in investment in marketing and other infrastructure that is going to vary quarter-to-quarter.
But I would say that we are attributing a good bit of the revenue growth acceleration from 17% in Q1 to 20% in Q2 to the rollout of one-day and the impact of that.
If there's other things, obviously, we continue to add selection and we have again lots of engagement points of customers through Prime Benefits and video and devices that certainly contribute to our revenue run rate in our retention of Prime members.
But if we're going to point to one thing in Q1 that's different -- Q2 excuse me, that's different it was obviously the start of the -- and the step up in one-day shipments.
But my main question is just looking ahead of the holiday period given some of the moving parts and 3PL and shipping ecosystem and then of course with the transition to one-day, are you confident that there is enough capacity from your own first-party logistics as well as third-party partners to meet that seasonal demand and should we now expect a faster ramp in Amazon Air as the means to move cargo between fulfillment centers?
A lot of good work went into Prime Day, a lot of benefit for customers, a lot of benefit for our selling partners, the small business merchants as well.
We certainly have a lot of areas where we continue to invest not the least of which is our AWS business, devices, video, the global expansion of a lot of our Prime Benefits and things like stores and grocery delivery through Whole Foods, Prime Now and AmazonFresh.
Now the first part of your question, in terms of geographical mix, I mean, fair to assume that like a lot of our business, advertising in the North America segment is the bigger piece of that, but I think we're really excited about the international opportunity.
",59.37,0.9562017
amazon,q3,2019,"Joining us today to answer your questions is Brian Olsavsky, our CFO; and Dave Fildes, Director of Investor Relations.
Weâve got a great new device lineup you may have seen announced in September and on the AWS side, weâre looking forward to our re:Invent Conference in Las Vegas, where we welcome over 65,000 conference attendees.
Brian, I just wanted to ask you kind of more broadly about Prime One Day, what your biggest learnings have been so far over the past several months as youâve been increasing availability?
So as we head into Q4, weâve added whatâs just nearly a $1.5 billion penalty in Q4 year-over-year for the cost of shipping, which is essentially transportation costs, the cost of expanding our transportation capacity, things like adding additional poles and shifts in our warehouses, the cost for deploying inventory closer to customers, thereâs a lot of tangential costs, by and a way the biggest expenses is on the actual transportation cost.
We continue to feel really good about not only the top line, but also the bottom line in that business, but we are investing a lot more this year in sales force and marketing personnel, mainly to handle a you know wider group of customers, an increasingly wide group of products, we continue to add thousands of new products and features a year, and we continue to expand geographically.
So the biggest impact that we saw in Q3 year-over-year in the AWS segment was tied to costs related to sales and marketing year-over-year and also to a secondary extent, infrastructure, which if you look at our capital leases or equipment leases line, it grew 30% on a trailing 12-month basis in Q3 of this year and that was 9% last year.
Can you just sort of talk to some of the steps, you have to take over the next one to two years to get the One Day shipping costs closer to what they used to be for Two Day, and how do you think about how long itâs going to take?
We know we have temporary costs in the short run as we do things like forward deploy inventory, get greater inbound into those warehouses, set up new Amazon Logistics, AMZL capacity, staff you know multiple shifts, so that we can have later pull times to hit One Day cut-offs, things like that, adding sort centers.
But in the long run weâre going to have a combination both of our own capacity, certainly fueled by helps with third party carriers, large carriers that weâve used in the past.
But on the cost side, yes itâs going to be the route density and other things will improve over time and get our cost structure down, but for now, there is certainly some start-up paying in adding new capacity.
In the past that pointed to investments in technology teams and thatâs certainly part of it, but by in a way the biggest driver this time is the people that weâre adding for fulfillment and transportation roles, especially as we head into Q4 and add this additional transportation capacity to service One Day. So Brian, Iâm wondering if you can weigh in on the puts and takes on the long-term potential margin for AWS?
And we also see a point out that you know increasingly what weâre doing is renegotiating or negotiating incremental price decreases for customers who then commit to us long term.
So we do attribute it to One Day. So you know there has been some reduction in the threshold for some lower ASP items that weâve been doing separately over the last six months that have spurred some sales in lower ASP items, but we think that is again the right decision for customers, especially over the long term.
But again in your question on enterprise penetration, you know I think the enterprise, weâre making great progress there.
So I think thatâs largely what dictates our roadmap and making sure that we give ourselves autonomy and availability to look to new areas and stay on the cusp of whether itâs kind of emerging technologies or really just our customer needs or pain points that need to be solved.
But our focus is really on ensuring that weâve got capacity from available resources, whether itâs our own or our great carrier partners to be able to serve the small and medium-sized businesses in the 3P realm, but also the first party items that we are receiving orders from customers, making sure weâre able to deliver those things quickly and reliably.
Just wondering back on the shorter holiday season, do you think thatâs going to be a headwind for overall online sales in the quarter, anything specific to Amazon?
Additional information about factors that could potentially impact our financial results is included in todayâs press release and our filings with the SEC, including our most recent annual report on Form 10-K and subsequent filings.
And can you also just help us understand how thatâs playing into your operating income guidance for 4Q?
Our next question comes from Brian Nowak with Morgan Stanley.
Thanks for taking my questions.
Thanks for taking my questions.
Thank you for your questions Heath.
Our next question comes from Stephen Ju with Credit Suisse.
Our next question comes from Scott Devitt with Stifel.
Our next question comes from Colin Sebastian with Baird.
Yeah Colin, hey itâs Dave.
",56.83,0.8745304
