Company,Quadrant,Year,Summary,Linguistic Complexity(Flesch Scores),Sentiment
jpmc,q4,2018,"The increase is related to investments were making in technology, marketing, real estate and front office, as well as revenue-related costs including growth in Auto.
Revenue of $111.5 billion is also record and was up nearly $7 billion or 7% year-on-year, $4.3 billion of which was higher net interest income on higher rates with growth and Card margin expansion being offset by lower markets NII.
At the end of the year, the adjusted expense was $63.3 billion, up 6%, which brings our overhead ratio to 57% for the year even as we continue to make very significant investments across the franchise.
For the quarter, core loans were up 5% year-on-year, driven by Home Lending up 8%, Card up 6% and Business Banking up 5%.
Card revenue rate was 11.6% for the quarter and 11.27% for the year as expected.
We ranked Number 1 for the year and the quarter and saw our leadership positions across all products globally with particular strength in IPOs as well as in the technology and healthcare sectors.
Revenue of $3.4 billion for the quarter was down 5% year-on-year with the impact of current market levels driving lower investment valuations and management fees as well as to a lesser extent, lower performance fees.
Expense of $2.6 billion was flat, as continued investments in advisors and in technology were offset by lower performance-based compensation and lower revenue-driven external fees.
For the quarter, we saw net long-term outflows of $3 billion with strength in fixed income more than offset by outflows from equity and multi-asset products.
Net interest income will continue to benefit from the impact of higher rates and growth but quarter-over-quarter will be negatively impacted by day count.
So, to close, while the markets in the fourth quarter were more challenging, we should not lose sight to the fact that 2018 was a strong year, indeed a record for revenues, net income and EPS, both reported and adjusted for tax reform.
So, the way bank stocks have performed, clearly, investors are starting to worry about revenue trends near-term and of course credit, which you addressed.
Im wondering if the revenue trends continue to be weaker than expected, if the overhead ratio of 57% that you posted in 17 and 18 is something that you could continue to level off to, or will the investment horizon be more of a dominant factor when were thinking about the overhead ratio.
But that said, we have -- while we dont set expense target, nor do we set overhead ratio targets, we have given you some outlook that would suggest that we continue to believe that combination of revenue growth and expense discipline, notwithstanding the investments that weve been making, we should see our overhead ratio continue to be stable to trending down to the kind of mid-50, so 55ish%.
And just as a follow-up question, the market is also thinking that the last rate hike from the Fed was December, and I'm wondering how we should think about the dynamics of net interest income and more specifically net interest margin and deposit pricing if December was indeed the last rate hike for some time.
So, if it is a pause because you are going to recession, youre going to do trades that obviously is very different than its to pause, economy is strong and they raise rates, you know which one you would choose.
But over the course of the last couple of years as we've experienced that performance, we've done sort of surgical risk pullbacks, and we amended our collection strategy, all of which have led to a charge-off rate for the fourth quarter in 18 that's down slightly year-on-year and for the year that's a 310 basis points which is reasonably meaningfully below our expectations, even as late as the end of last year.
So, we feel great that that kind of loss trends at that 310, maybe a little bit higher is something we should look forward to at least into 2019.
Just wondering on the markets commentary, obviously super early in the quarter, but you mentioned things feeling better.
And then, also in the fourth quarter, what you saw in leverage lending market, how much do you have to take in terms of maybe marks and leveraged loans and the hung deals?
So, I would say that obviously the fourth quarter was challenging and there was a lot of market moves, a big sort of broad set of.
And at that point, there were elevated concerns around trade, global growth data was causing concerns, there were concerns that the Fed was going to continue to be hawkish and not necessarily as responsive to some of the things the market was worried about.
So, yes, we could see slower growth but still growth in the U.S. and across the globe, a slightly more constructive narrative on trade and that continues to broadly progress we hope and believe in a positive direction, and a more dovish outlook from the Fed that potential for that to be pauses in rates or being relatively supportive.
Thats not to say that there's no deal that has the potential for there to be net losses after fee, but nothing that we would consider to be significant and nothing in the fourth quarter.
I would also say that coming back to the first quarter that actually the market could be quite constructive to fixed income into the third quarter, given a more dovish Fed supporting corporate margin, corporate default rates are going to stay pretty low and we do have time.
So, its no good of a conserve talking about how we think things are going to pan out in time in the first quarter other than just the general comment Ive already made, which is the environment should be more constructive and were expecting decent volatility in client activity and we will see how that pans out.
And we take the same division, we had strong first half of the year and we said long may it continue but it may not and one quarter doesnt make a trend.
So, in that role, what are you doing to help JPMorgan and I guess the other banks in terms of China, the government shutdown, immigration, some of these headline issues that Marianne talked about, having hurt the CIB in the fourth quarter?
And then, my follow-up question is that obviously that capital markets had a tough time but you are wholesale lending, the growth has accelerated quite nicely.
For us in fact, it was largely driven by one investment grade loan that we extended at the end of the quarter but there was a little bit of an uptick and a little bit more in terms of acquisition financing and the balance sheet but nothing I would call -- nothing that I would call unusual or a trend.
But as long as you feel as we do that the decision criteria that we use to determine the investments we're making which we think are strategically important for long-term growth of the company and the profitability of the company, supporting clients, if those are good decisions for long term growth, while we could obviously make changes, we would not look to do that.
We think it sort of differentiates our long term performance and we'd like to continue to do that.
I guess what I'm getting at is, last quarter you had modeled -- I guess what I'm getting at is like, it's -- are we at the point where like just a couple of lumpy loans was going to drive a few hundred million reserve build or is it just -- maybe it's a bit unusual still.
So, there is no doubt that as things continue, if there is a level of anxiety and uncertainty, its just not constructive for confidence and confidence that gets stronger or less strong market.
And I suspect well get more color at Investor Day but just want to get your sense of the sustainability of growth and you mentioned on the commercial side, you maybe scale back a little bit, maybe were late cycle.
So, I think its -- and incredibly nuance question, because in general, home lending has a challenging market backdrop.
So, there is a challenging market backdrop, card was doing well at and its sort factor of all things we talked about, investments in digital product, rewards all of the above.
And in many of our businesses, were going to protect profitability and credit discipline over growth at this point.
Similarly, something like auto lease where we grew our auto lease business, revenues and expenses strongly in 2018 and that will be in our run rate in the first quarter.
So, its fair to say that money market rates traded above IOER throughout the fourth quarter and more pronounced at the end of the quarter.
We continue to have a bit of that mix shift in the first quarter and its a market opportunity.
And then, a separate question on, I know its not a big revenue driver anymore but within mortgage banking, you had a negative gain on sale in the quarter.
And at some point, we would expect both of those things to normalize but we would continue to see solid growth in all of our drivers.
And so, if you look at your at banking system, if you look at the leverage lending bridge book in 07, it was over $400 billion; today's its number like 80.
Starting on Page 1, the firm reported fourth quarter net income of $7.1 billion and EPS of $1.98 on revenue of nearly $27 billion with a return on tangible common equity of 14%.
Market impacts aside, underlying business drivers remain solid, increasing core loans and deposit growth, consumer sentiment and spending in a robust holiday season, faster market activity and the credit performance continuing to be very strong across businesses.
For the full year 2018, the firm reported revenue of $111.5 billion and net income was $32.5 billion, both clear records even adjusting for the impacts of tax reform.
Non-interest revenue was down slightly, with lower market levels impacting Asset Wealth Management fees and Private Equity losses being offset by higher Card fees and Auto lease growth in CCB.
Non-interest revenues was up $2.5 billion or 5%, driven by CIB Markets and growth in Consumer being offset by Private Equity losses and the impact of spread widening on FCA.
And although we are showing modest positive operating leverage on a managed basis, remember our revenues were impacted by lower growth in Cards given tax reform.
Adjusted for this or looking on a GAAP basis, we delivered nearly 200 basis points of positive operating leverage for the year and well over 100 basis points for the fourth quarter.
Credit costs were $4.9 billion, down 8% driven by lower net reserve build in Consumer as well as the impact in 2017 of student loan sales.
Risk-weighted assets decreased with loan growth more than offset by derivatives counterparty and trading RWA given a combination of seasonality, market conditions and all the enhancements.
Despite volatile markets, client investment assets were still up 3% and we saw record net new money flows for the year.
In Consumer & Business Banking revenue was up 18% on higher deposit NII driven by margin expansion.
And Cards, Merchant Services & Auto revenue was up 14%, driven by higher Card NII, although loan growth and margin expansion, lower card, net acquisition costs, principally Sapphire Reserve and higher Auto lease volumes.
Expense of $7.1 billion was up 6%, driven by investments in technology and marketing and Auto lease appreciation partly offset by lower FDIC charges and other expense efficiencies.
On Credit, net charge-offs was down $18 million as modestly higher charge-offs in Card were more than offset by lower charge-offs in Auto and Home Lending.
We maintained our number one brand rank for the year and continued to hold strongly lead-left positions in high-yield bonds and leveraged loans.
Total revenue was $3.2 billion, down 6% reported and down 11% adjusted for the impact of tax reform and Steinhoff margin loan loss last year.
A confluence of factors throughout the quarter including trade, concerns around global growth and corporate earnings, fears of lower mortgage fares as well as other negative headlines caused spikes in volatility which were amplified by markets that assets and liquidity.
And although we saw decent client flow, rates rallied, spreads widened and energy prices fell significantly, all against general market conviction that was anticipating a stronger end to the year.
Weaker performance across rates, credit trading and commodities was partially offset by good momentum in emerging markets.
Treasury services revenue was $1.2 billion, up 13%, driven by growth in operating deposits as well as higher rates but also benefitting from fee growth on higher volumes.
Underlying this was strong fee growth and a modest benefit from higher rates together being substantially offset by the impact of lower market levels and the business exit.
Full-year IB revenue was a record $2.5 billion, up 4% on strong activity across segments, in particular middle market banking which was up 8%.
Deposit balances were up 1% sequentially as client cash positions are seasonally highest toward year-end although down 7% year-on-year as we continue to see migration of non-operating deposits to higher yielding alternatives.
Underlying credit performance remains strong with credit costs at a $106 million including higher loan loss reserves, largely due to select client downgrades.
Other corporate saw a net loss of $752 million, including on a pre-tax basis funding our foundation for corporate philanthropy $200 million this quarter, flat year-on-year, and including a $150 million of markdown on certain legacy private equity investments market related.
[Operator Instructions] Our first question is from Erika Najarian of Bank of America.
Yes. Thats about public policy, thats good for growth of America in total, and so very specifically stayed away from doing about banks there.
Last one, obviously markets all went down in the fourth quarter and we had some freeze-ups if you will in high yield first time in like 10 years.
And right now its good, sentiment in consumer and we just got back some sentiment from I hope small middle market companies that while not at their high, but still very high.
Yes. Based on the prior conversation, it seems like 1Q might be in aberration of mid single digits or should I take that thats kind of the run rate you are expecting for the full year?
Jamie, you did make a comment recently at investor conference talking about how the banking industry is over-earning on credit, not particularly a controversial remark.
I think, I hate to say this because I know that you don't want to wait a few weeks but we'll have a more complete conversation about kind of range of total outcomes on credit at Investor Day but we -- when we gave our medium-term simulation we said listen, we did a 17 return on tangible common equity in 2018 and our medium-term guidance is for 17%.
I think people in general have done a better job underwriting middle market and leveraged up than it did last time.
Its causing changes in that banks now have options other than reserves at the central bank because the two-year and three-year bond yields for corporate -- government bond is much higher, some people are preferring to own that because they think it would be paid better than corporate risk.
Before Marianne answers that question, I just want to do a shout out to Jefferies because we actually look at what everyone does and every investment banking group, and you guys did a hell of a good job in healthcare this year.
And you know importantly if it really is the case that we have to upfront significant amounts of capital for longer term and lower credit quality loans I do really believe even though the cash flows and the economics, secular change, that you might find people less willing to lean into growth for longer duration assets if there are concerns around potential business.
",45.43,0.5926973
