Company,Quadrant,Year,Summary,Linguistic Complexity(Flesch Scores),Sentiment
jpmc,q3,2016,"Starting on page one and taking a look at the quarter, we had strong performance in each of our businesses despite the continuation of reasonably challenging conditions.
Highlights of the quarter include the highest reported revenue for third quarter in the CIB with IB fees up 15% and markets revenues up 33%, with strong performance across the board, robust core loan growth for the Company of 15% on the back of sustained demand across businesses, and the continuation of strong credit performance including a net release for oil and gas.
On the back of continued strong growth in core loans, net interest income was up $700 million and is trending for the full year to be above the $2.5 billion guided last quarter.
Adjusted expense of $14.5 billion was up $500 million, both year-on-year and quarter-on-quarter, largely driven by two notable expense items in consumer, which Ill talk about later, as well as the increase in FDIC surcharge which took effect this quarter and some higher marketing expense.
Credit cost of $1.3 billion in the quarter includes consumer reserve build of $225 million, primarily card, but against that we have a net reserve release in wholesale for oil and gas of about $50 million.
And while its primarily driven by mortgage, we also saw 14% growth in auto, 9% in business banking and 7% in card loans.
Mortgage revenue was up 21% on higher MSR risk management but also on higher production margins and growth in NII as we continue to add high quality loans to our portfolio.
Looking forward, assuming strong demand for Sapphire Reserve through the fourth quarter, we would expect revenues for CCSA to be down about $200 million quarter-on-quarter on higher acquisition costs but it will clearly be dependent on the number of new accounts originated.
In cards, we built $200 million of reserve this quarter, reflecting growth in the portfolio including newer vintages which have a higher loss rate than the portfolio average, consistent with our discussion during the second quarter and consistent with how we underwrite the loans.
Total revenues of CIB of $9.5 billion, up 16% year-on-year was the best reported performance for a third quarter and included the highest IB fees on record for third quarter too, up 15% with strong market performance across the board, revenues up 33%.
Coupled with solid credit performance, including a modest reserve build for oil and gas here, the business delivered a pretty clean $2.9 billion of net income and a 17% ROE this quarter.
Revenue of $3 billion was up 5% year-on-year, driven primarily by strong banking results on higher loan and deposit spreads.
Looking forward to the fourth quarter, expect net interest income to be up modestly quarter-on-quarter on continued strength in loan growth, even as we digest the incremental cost of resolution based liquidity actions, which will be pulling in our run rate in the fourth quarter.
Finally, expect adjusted expense in the fourth quarter to be flat year-on-year, bringing full year expense in at approximately $56 billion consistent with our guidance and self funding the consumer items I mentioned.
And while as a Company, we are proud of this quarters performance and in particular proud of the growth in the underlying business drivers, we take a long-term disciplined view and remain focused on delivering excellent customer experience, strong execution, particularly in risk management and expenses so that we can continue to deliver best-in-class performance.
So, we may have gained some share, certainly, hopefully the momentum in terms of the business weve been building in the way we are serving our clients, will serve us in that capacity, not just this quarter but through time.
So, I dont know Glenn if you recall, we had a bit of discussion about this last quarter and sort of guided to the fact that we would expect to see our loss rates go up slowly, I mean partly because obviously 250ish basis points, I think we could call that pretty low historically.
And so, as you look forward for us over the course for the next several quarters and we would expect those phenomena to generally continue again slowly, were growing our portfolio, were going to see the seasoning of those vintages as the mix increases and as they become more seasoned, cause us to build a reserve but for the right reason.
Marianne, just wondering, you mentioned that part of the increase in consumer cost this quarter was planned investments and that youre continuing to self fund.
I am just wondering as you think forward and we get past this good gear that youve had, will that be kind of underlying expectation for you guys, again with the understanding that the revenue environment will always take things up or down; but do you have an aspiration that you can continue to keep costs flat?
But based upon the speech moving to a baseline minimum standard is more consistent with how we think about our capital management policy and using the capital stack add-up using our G-SIB Score and our stress drawdown, actually you would come out with a sort of capital constraint on the CCAR thats pretty much on top of our regulatory capital minimum.
So, first of all, based upon last years results for us, we are at the flow for the stress floor for the stress capital buffer, not to suggest by the way that we wouldnt continue to want to properly understand and better understand how we can through time make sure that we are performing the best we can on the stress within our risk appetite.
Weve built $25 million of reserve this quarter for auto and we expect to continue.
One of the questions weve been getting from a lot of folks is because this SEB is calculated based on stress losses year-to-year and historically CCAR results have been pretty volatile, I am wondering how you are thinking about the appropriate management cushion or buffer above the minimum.
Our spot balance sheet closed a little over $2.5 trillion, principally a result of strong deposit growth, as well as liability action taken to raise liquidity in the context of resolution, which also drove up liquid assets.
Card, commerce solutions and auto revenue was down 1% as a strong momentum in card and auto volumes and balance growth was offset by higher card origination cost and the remaining impact of co-brand renegotiations.
Underlying this expense performance is an incremental investment of $250 million in marketing and auto lease growth which is in line with investor day guidance and largely self-funded with expense efficiency.
Rates was a standout in terms of performance this quarter as markets stayed active post Brexit with good client flow, as well as anticipation of an uncertainty around central bank actions.
And credit and securitized products came back from a weak prior period with a recovery in the energy sector and central bank actions motivating clients to put money to work, producing a much more constructive market making and new issuance environment resulting in a particularly strong quarter.
Equities revenue was up 1% compared to a strong third quarter last year with Asia matching last years strong performance and strength in North America flow derivatives offsetting weakness in cash volume.
Commercial banking reported record net income of $778 million on revenue of $1.9 billion and an ROE of 18%.
CRE loans grew 19%, reflecting strong originations in both commercial term lending and real estate banking.
Finally, credit performance remains strong with a net charge-off rate of 10 basis points, roughly half of which was driven by oil and gas.
Outside of energy, credit quality is good and the commercial real estate portfolio had no net charge-offs during the quarter.
We saw positive long-term flows of $19 billion with strength in multi assets including the benefit of a large mandate this quarter, as well as inflows and alternatives in fixed income, partially offset by outflows in equity products.
Expect non-interest revenues to be down quarter-on-quarter based upon our current outlook for IB fees and assuming flat year-on-year markets revenues, also including higher card acquisition costs and seasonally lower mortgages.
Just one follow-up if I could get a just a high level comment on has anything materially changed in terms of rate or curve sensitivity as you remix the portfolio and as youre getting all this great loan growth?
We obviously did get some good inflows, liquidity flows in terms of money market reform into our government funds but we also have been very focused in our other wholesale businesses on continuing to attract operating deposits.
Your next question comes from Erika Najarian from Bank of America.
You pointed out that about three quarters of your credit card acquisitions organic growth coming through mobile channels or digital channels I should say.
",42.58,0.76033884
jpmc,q4,2016,"So starting on page 1, we had a strong end to the year, with record net income for a fourth quarter of $6.7 billion, EPS of $1.71, and return on tangible common equity of 14% on revenue of $24.3 billion, reflecting strong performance broadly across our businesses in a more constructive environment.
In addition, markets revenue was the highest on record for a fourth quarter, up 24% year-on-year, and credit performance remains, strong with net reserve releases across both consumer and wholesale.
Revenue of $24.3 billion was up $600 million or 2% year-on-year, driven by net interest income on the back of continued strong loan growth, as well as the impact of higher rates.
Adjusted expense for the year came in at $56 billion as expected, and our adjusted overhead ratio improved to 57%, as we continued to execute on and near the end of our strategic cost programs in CCB and CIB, as well as self-funding incremental investments in growth of nearly $1 billion year-on-year.
Another outstanding quarter in commercial banking, with net income of $687 million, record revenue of $2 billion, and an ROE of 16%.
Looking forward to the first quarter, expect net interest income for the Firm to be up modestly, reflecting impact of the December rate hike, as well as continued loan growth.
So I wouldn't call it a deceleration per se, but know it is a little bit lower so I think going into 2017 our expectation is that we would continue to grow loans strongly but possibly at the lower end of that range rather than the higher and of course, to a degree it will depend upon our mortgage portfolio but we intend to continue to add to that too, so sitting here today I'd say more high single 10% plus or minus and we'll give you more updates at Investor Day. Betsy Graseck
I just wanted to dig in a little bit on the forward look NII up a bit but also expenses up a bit and I just wanted to understand is that because you've got the opportunity to reinvest in things that you haven't been able to and if you could just speak to what caned of time frame the reinvestment will yield returns because the question I've gotten from people is why aren't you dropping the NII benefit to the bottom line here.
Volumes, transactions, everything is growing very strongly and although we still have some work to do to finish the large expense programs we're near the end of that, so just generally speaking, we're continuing to invest in the businesses and we'll see the improvement in our expenses flatten out and start to grow with volumes and that would also support growth in non-interest revenue outside obviously as the card phenomenon we talked to you about.
Now obviously we need to continue to that but we are very encouraged by not only the excitement in our customer base but also the way that the trends are performing in terms of spend and engagement, but when we introduce a new product we intentionally introduce a very exciting premium promo and its intended to generate excitement and I think you would agree it did, so we're delighted with the response that we've had and we've actually kept it up for longer than we initially expected but it's normal for us to come down from those intro rates as the product becomes more mature and that's what we are doing but to be very clear about our expectations of the performance of the card even at 100,000 points.
So I think in the conference in November, Kevin Waters said that as we look at the new products and we look at them growing coming out in 2016 and into 2017, we would expect the card revenue rate for the year next year to be about 10.5% after which as the cards and their accounts season and drive revenue growth we should see that continue to trend back up to a level in the past.
I mean, I think that it's actual detail of Retail spend, auto sales, house prices, household formation, confidence numbers, so I'm not basing it on the market just based if you look at a broad range of things that looks like growth may have gotten a little bit better in the fourth quarter plus if you take a walk around the world, Japan is doing a little better, Europe is doing better in fact one of the IMF came out yesterday and both global growth will tic up next year so it's just those factors.
And maybe just if we give you a bit of insight into the philosophy about how we do our investment and expense budgeting when we talk to our businesses, regardless to Jamie's point about necessarily whether the external factors are moving, the question is what do we want to do in terms of products and services and technology and bankers and offices that we can execute on well and responsibly and that is typically what defines us not our appetite to investor dollars, so I think we've told you pretty consistently that and you've seen it we added 130 net new bankers, we opened eight offices in the commercial bank, we're investing in technology very, very broadly, payments, digital across the Company so I would say that we don't feel like we've been held back in terms of our appetite to invest because of concern around the economy and in the same way, a more confident outlook in the economy won't step change that but we will continue to look for great investments everywhere we can and make them.
Obviously your peers and a lot of investors have been growing in their optimism for this you're in terms of animal spirits and everything else and just want to get a sense of how you're thinking about it do you share that optimism and any commentary on how we can think about both banking and trading into the New Year with all of the moving parts that we have around policy, etc.
So I would say just if we separate the two and just talk for one second about banking, you know fundamentals for a solid M&A year are there and obviously there will be puts and takes depending on what happens in the policy and reforms space, but we're optimistic about a solid M&A market but with the continuing trend of fewer mega deals but nevertheless good flow.
So yes, Matt it does include the benefit of higher long en rates and if you get the Q an get our disclosure on net income risk you'll get math that looks similar to that $1.5 billion or more, and then with respect of sensitivity from here, clearly it's not linear, so you can see if we just look at the Third Quarter, the first hundred basis points this is an illustration of $2.8 billion, 200 basis points of 4.5 so as we clip away, 25 basis points a time or $2.8 billion will start to come down and so that's broadly the outlook.
And actually my follow-up question, on the size of the balance sheet you did talk about loan growth of about 10% this year, if you look full year 16 versus 15 the balance sheet or the earning assets only rose 1% so maybe tie that into as you think about duration, the fact that you're sitting on a lot of liquidity and cash and how we should think about both overall growth in the balance sheet and then potentially some more remixing.
Yes, so what you saw happen in 2016 was not only obviously a rotation from securities and deploying deposits into loans but also we took a very large amount of non-operating deposits out of the balance sheet in 2016 so that is having an impact but we would expect to continue to grow our loans to grow our deposits strongly to manage the overall balance sheet through our investment securities portfolio and from here, if everything continues to be as the market implies we should see margin expansion.
Yes, so answer is across the metals and mining and energy, we have a little over $1.5 billion of reserves and there is a normal level of reserves that we will have that would be a large chunk of that and as you saw in 2016, we did take charge-offs of a little less than $300 million, so we will continue to likely see on a name specific basis as people work through their business models that there will be more charge-offs but ultimately if anything stays stable or improves, and of course we have to see that be somewhat sustained and find its way flowing through the financial statements of our clients then as we upgrade them god willing then we will see more reserve releases but it's going to take some time and we'll start to see that think about the large reserves we took.
We took them at the tail end of 15 and into 2016 we'll start to see new financial data from our clients, we'll start to do the borrowing base redeterminations and look at the impact of prices on reserves in the Spring so we'll start getting data this year so we may see more releases but it's going to come through over time.
Yes, I would say that when I talk about the overall core loan growth going down still being strong, it does reflect the fact that we've been seeing very strong outperformance in our growth over the course of the last couple of years particularly in commercial term lending and while we continue to believe there's great opportunities there, they will be lower so we've been printing in the teens pretty consistently and I would say it will be less and maybe more in the high single-digits but we will keep you updated.
Remember we don't run the business next quarter next month, because Assets Under Management are going up and these corporations are going up, fixed income mortgage will go up, need for FX goes up and needs for hedges go up so over time we know there's a cyclical increase and we try to estimate how much is cyclical and there will be a flip side of that and I think you might have gotten to the end of the secular cyclical decline.
I'd tell you compared to the targets that they set we still have a few hundred million dollars to deliver them and Daniel will go through that at the Investor Day. To my mind, that was a product that's done particularly well this quarter but I was wondering looking forward how you see that performing whether it's supported by what's going on in yield curve or whether do you see that supported more by sort of like one off euphoria around election so maybe that might tail off a little bit and then just moving on from that, how do you view the opportunities for growth in your Capital Markets businesses, your CIB versus say your lending businesses.
And Marianne coming back to the investment portfolio, obviously you talked a little bit about the duration.
Just a quick question for you Marianne, in terms of the mortgage in the overall picture, I understand why you're talking about maybe 10% core loan growth rather than 15% more recently, but just within the residential mortgage portfolio, it looks like that slowed in the fourth quarter, third and fourth quarter from a midteens year-over-year rate to a low single-digit quarter-over-quarter rate.
I think there was a little bit of that in the fourth quarter, particularly relating to actively managed product.
Wouldn't that delay some activity for at least a couple quarters for people to kind of see where we are going to end up and see where tax rates are and see what we might get in deregulation that may change perspective on the long term opportunities, so just thought there might be a little pause here.
Highlights for the quarter included core loan growth of 12% with strength across businesses, continued double-digit consumer deposit growth, ending with deposits over $600 billion, and record card sales volume up 14% on continued strong momentum.
Non-interest revenue was flat year-on-year, with strength in markets offset by higher card new account acquisition costs.
Non-interest revenue remained flat year-on-year, reflecting strength in markets and funding card new account acquisitions, as well as lower asset management revenues.
Net capital generation for the quarter were a positive, included a 16 basis point impact of higher rates on investment securities AOCI.
Consumer and business banking revenue was up 4% on strong deposit growth, and mortgage revenue was relatively flat as higher production margins and volumes were offset by lower servicing revenue on lower balances.
Revenue of $3.1 billion was up 1% year-on-year, driven primarily by strong banking results on higher deposit NII and continued loan growth, predominantly offset by prior period asset disposals.
Your first question comes from the line of Ken Usdin with Jefferies.
Your next question comes from the line of John McDonald with Sanford Bernstein.
Your next question comes from the line of Mike Mayo with CLSA.
Your next question comes from the line of Jim Mitchell from Buckingham Research.
At ECM looks set to be quite active and the IPO market continuing to recover and debt Capital Markets has a solid pipeline in terms of the refinance arena, but having said that interest rates may have an impact so I think pretty solid pipeline coming into the year but lots of factors will ultimately affect the full year.
Your next question comes from the line of Glenn Schorr with Evercore ISI.
I think if you look at again, there's a lot of wood to be chopped and sausage to be made before tax reform gets done and some of these things are brand new and they've never been talked about or done before so you can read a lot of studies obviously for banks to run net interest income so it doesn't directly change how you look at it so for everybody else it affects complete industries differently.
Your next question comes from the line of Matt O'Connor from Deutsche Bank.
Your next question comes from the line of Matt Bernall from Wells Fargo.
Your final question comes from the line of [indiscernible].
",32.77,0.5111066
