Company,Quadrant,Year,Summary,Linguistic Complexity(Flesch Scores),Sentiment
jpmc,q1,2018,"Starting on page one, the firm reported net income of $8.7 billion, EPS of $2.37, and a return on tangible common equity of 19% on revenue of $28.5 billion, benefiting from broad based strength in performance, but also lower taxes and seasonality.
So, this quarter's performance in context, on a core basis pretax earnings grew 13% year-on-year, benefiting from higher rate, solid growth across other revenue drivers, and continued investments in our businesses.
Included in the results, you see on the page, approximately $500 million of mark-to-market gains on certain investments previously held at cost due the adoption of a new accounting standard.
This impact which was also about $300 million for the quarter, reduced revenues, was split about 50/50 in NII versus NIR, an offset in tax expense.
Non-interest revenue was up $1.6 billion year-on-year and while it includes the mark-to-market gains on the first page, it also includes approximately $400 million of losses on investment securities and legacy private equity investments.
You'll see that our effective tax rate for the quarter ended a little above 18% compared to the 17% guidance we gave, driven by a combination of higher pretax earnings as well as geographical mix.
So, the reduction was driven by higher risk weighted assets reflecting the increased level of market activity, which similarly impacted all other ratios.
Client investment assets were up 13% year-on-year with half of the growth from net new money flows and with record flows this quarter.
And Card, Merchant Services, and Auto revenue was up 18% including higher Auto lease income, but it was driven by Card on lower net acquisition costs, higher loan balances as well as margin expansion.
Recall, last year included a net impact of a little over $200 million related to the student loan portfolio sale.
Equity underwriting fees were down 19% in a market that was also down and versus a strong first quarter last year, which included a number of large deals.
However, as mentioned, this includes the mark-to-market gains we called out on the front page and also includes a reduction of about $150 million reflecting lower tax equivalent adjustments year-on-year.
Treasury Services and Security Services revenue were both $1.1 billion for the quarter and up 14% and 16% respectively, driven by higher rates and balances.
So both, while client sentiment is high in the wake of corporate tax reform and we remain hopeful that this will support higher demand later in the year, we're not seeing that yet and we are maintaining pricing and credit discipline.
And while acknowledging the tailwinds of tax reform and higher rates, the consistent performance of business drivers is translating into topline growth and positive operating leverage with revenues and pretax income both up double-digits year-on-year.
Similarly, mark-to-markets as we talked about after the first quarter performance that's a driver and then as the ongoing sort of growth in the Auto lease income space which is significant.
Outside of that, you look at our underlying drivers across the Board in terms of new accounts and debit trends in Card sales and Asset Management fees as a driver too, so there's obviously a level of market dependency to it, but a bit of the sort of outsized year-on-year increase is seeing the -- somewhat tailwind of Card and market, both in the trading and in the Asset Management base.
Yes, I'll start with year-over-year, we're still getting significant benefits from our investment and expansion markets and also as you know we had a pretty -- we have a pretty unique sort of offering in terms of first term lending and so, for a period of time in both of those bases, we've been materially outperforming the market and so we're still seeing the benefit of that in our year-over-year numbers.
So, quarter-over-quarter what we're seeing is just the impact of the sort of overall industry-wide slowdown and the fact that you're right, it's not just pricing, it's just generally we continue to be very selective and cautious given where we are in the cycle, but we're not expecting flat for the year, we're expecting growth in the mid-single-digits for the year and we still believe that there should be demand.
So, generally across the -- sort of whole industry, I suspect the answer to the question is yes, but remember for us that we haven't been constrained by leverage -- Tier 1 leverage or SLR over the last -- over the last several years.
So, we gave you the stat -- that I think at Investor Day, we see more Card spend both debit and credit, but we also see higher deposits and investment, so digitally active customers.
I think our earnings at risk disclose at the end of last quarter was $1.7 billion, you go forward a quarter and that comes down a little less sort of realized rate benefit, but we've also seen as you know somewhere in the sort of mid 40s basis point increase in rates sort of front and long end which will also have a somewhat significant impact.
So, I would handpick and say of the increase more than half was related to volatility and obviously some of the volatility was somewhat significant, we wouldn't necessarily expect to see that level continue, albeit that we would expect to continue see periods or episodes of significant volatility and a bit less than half to do with positions principally, but not exclusively as a result of higher levels of client activity in the CIB any sort of balance sheet wants to go up and risk weighted assets and so on.
So, my first question to you Marianne is if the Stress Capital Buffer becomes final as proposed and now the industry has a BAU CET1 minimum that could move year-to-year, how does that change your outlook on how to think about dividends and buybacks from here?
Maybe just a question on the TCGA [ph], I know that we're all wondering if it's going to have an impact on loan growth, but what about credit, do you think that that has any positive impact, I guess, particularly on the Corporate side with higher cash flows going forward lower tax rate.
Yes, I would say across the Board actually all the way from full business to middle market, we're expecting sort of higher earnings more free cash and generally speaking, that would improve the sort of credit quality of the portfolio.
So, you're seeing that sort of relative impact of lower tax gross-ups and meaning portfolio and investment securities, if you were to adjust to that, they would have been up in line with rates.
First of all, last quarter was a -- this quarter last year, I'm sorry, was a record and so not that we don't always want to [Indiscernible] I still feel like we did pretty well and it's a little bit like the fixed income story last year, equity market in DCM was up and M&A was less strong in this year that turned around and I would say as we look at the results in ECM and DCM that were down, there were a few -- we were under indexed for the larger fee event for a combination of reasons; some outside of our control and some addressable and also some deals that we had hoped to have closed moved into the second quarter, which is all to say that actually if you look across the Board, M&A still look strong, DCM and ECM pipeline also looks strong.
Thank you operator and good morning everyone.
Adjusted expense of $16 billion was up 6% year-on-year, reflecting higher compensation expense as well as business growth including Auto lease depreciation.
Consumer charge offs were in line with expectations and guidance and there were no changes to reserves this quarter.
Consumer & Business Banking revenue was up 17% on higher NII, driven by continued margin expansion and deposit growth.
Charge offs were driven by Card and were in line with guidance and there were no reserve actions taken this quarter.
IBCs were $1.7 billion, down 10% from a record quarter last year and strong performance in M&A was more than offset by lower debt and equity underwriting fees.
Fixed income market's adjusted revenue was flat versus a strong first quarter last year with rates and spread markets reversing to more normal levels following significant outperformance last year, being offset by strong emerging markets and commodities performance.
A well-diversified story driven by broad strength and continued momentum throughout the quarter with increased volatility benefiting all of equity derivatives.
Security Services also benefited from asset based fee growth on both market levels and new client activity.
Finally, credit performance continues to be very good with zero net charge offs this quarter.
For the quarter, we saw net long-term inflows of $16 billion including $5 billion in active equities with strength across all regions benefiting from strong long-term performance.
Our first question comes from John McDonald of Bernstein.
Our next question comes from Glenn Schorr of Evercore ISI.
Our next question comes from Matt O'Connor of Deutsche Bank.
Yes. So, think about -- many of these investments are years old -- many years old.
Good morning Marianne.
Good morning Marianne.
Good morning Marianne.
Yes, good morning.
",46.74,0.9024948
jpmc,q2,2018,"The strength this quarter was broad-based across businesses and highlights include average core loan growth excluding CIB of 7% year-on-year, consumer deposit growth of 5% which we believe continues to outpace the industry; card sales up 11%; and client investment assets and merchant processing volumes, each up 12%.
We maintained our number one rank in Global IB fees and CIB delivered double-digit revenue growth across the board.
Net interest income was up $1.1 billion or 9%, reflecting the impact of higher rates and loan growth, partially offset by lower market NII.
Net interest revenue was up over $600 million, driven by strong performance in markets and IB fees and also higher auto lease income.
The legal entity loss, together with the rewards liability adjustment in cards are the two notable items I mentioned at the beginning for a total reduction of over $500 million pre-tax.
Client investment assets were up 12% with more than half of the growth from net new money flows and we are capturing an outsized share as our customers shift from deposit to investments.
Consumer and business banking revenue was up 17% on higher NII, driven by continued margin expansion as well as deposit growth.
And cards merchant services and auto revenue was up 6% driven by lower card acquisition costs, higher card NII on margin expansion as well as loan growth, as well as higher auto lease volumes.
This was largely offset by lower net interchange, driven by a rewards liability adjustment of about $330 million, reflecting strong customer engagement across our Ultimate Rewards offering.
Fixed income markets revenue was up 12% adjusted on the back of good client flow and decent volatility and with commodities making a notable recovery from a challenging prior year.
It was a record second quarter for equities with revenue up 24%, driven by strong client activity and favorable trading results, and with particular strength in cash, prime and flow derivatives.
Treasury services and securities services revenues were each up 12%, driven by higher rates and deposit balances, and security services also benefited from higher asset-based fees on new client activity and higher market levels.
Another strong quarter for this business with net income of $1.1 billion and an ROE of 21%.
Gross IB revenue of $739 million was up 39%, driven by several large transactions and strong underlying flow of business and the overall pipeline is robust and active.
C&I loans were up 3% year-on-year and sequentially due to increased M&A related financing with strengths in our expansion markets as well as in specialized industries, and despite lower tax exempt activity.
Finally, credit performance remains strong with a net charge-off rate of 7 basis points.
Revenue of $3.6 billion was up 4% year-over-year driven by higher management fees on growth in long-term products as well as strong banking results.
Expense of $2.6 billion was up 6%, driven by continued investment in advisors and technology as well as higher external fees on revenue growth.
For the quarter, we saw net long-term inflows of $4 billion with positive flows across multi assets, equities and alternatives, partly offset by outflows in fixed income.
Although both revenue and expense are trending higher market-related, given were only halfway through the year, were not updating our outlook at this point.
[Operator Instructions] Our first question comes from Ken Usdin of Jefferies.
Consumer deposit up 5% year-on-year, slowing down as we would have expected, while you have seen online competitors and even some regional competitors make some moves in the large bank space, we havent really seen that yet.
This quarter included one-time item, $174 million on the legal entity liquidation.
And our next question comes is from Betsy Graseck of Morgan Stanley.
Our next question is from Matt OConnor of Deutsche Bank.
Yes. So, linked quarter, reported down 2 basis points because of lower markets NII and higher market assets, $20 billion; core up 8 basis points.
Our next question is from Betsy Graseck of Morgan Stanley.
Starting on page one, the firm reported net income of $8.3 billion and EPS of $2.29 on revenue of $28.4 billion, all were record for the second quarter, even exceeding the benefit of tax reform.
Expense of $16 billion was up 8% year-on-year, with half of the increase directly related to incremental revenues, principally compensation in the CIB, transaction expenses and auto lease growth.
Core loans were up 7% year-on-year driven by home lending up 12%, business banking up 6%, card up 4%, and auto loans and leases also up 4%.
As a result, the card revenue rate was 10.4% for the quarter, but our full year guidance of approximately 11.25% holds.
In banking, we maintained our number one ranking for the quarter and year-to-date in Global IB fees and with a record first half performance, and we grew share across the regions.
We ranked number one globally as well as in North America and EMEA and gained share in a competitive environment, driven by IPOs and convertibles in the two most active sectors, healthcare and technology, which are areas of strength for us.
Total revenue was $5.4 billion, up 13% year-on-year or up 16% adjusting for the impact of tax reform and was driven by strong results in equities, solid performance across categories and with performance picking up in the second half of the quarter.
Revenue was a record for second quarter, up 11% year-on-year driven by higher deposit NII and strong investment banking activity.
But, the 11.25% for the year remains true, which is to say that while this may be slightly larger than normal, its not exactly one-time item.
And in the retail also space for example, we talked about commercial real estate for example, mortgage clearly with capacity and the systems for example, all of those areas are pretty competitive for a variety of reasons given where we are in the cycle in the economy and like.
I wanted to ask you what you are seeing this quarter in terms of customer deposit trends, a little more color on both the pricing beta and volume balances.
So, were going to continue to advance -- and its got very high net promoter score by the way.
And so, I would characterize loan growth as solid and our expectations for the outlook to remain solid, benefitting from very active capital markets environment.
And maybe as a follow-up, when we think about NIM going forward, I mean, I think it was a couple of years ago that you talked about maybe normalized being somewhat the 265 to 275 range or 246 now.
But, we are on a core basis -- and remember, we have a fairly sizeable market balance sheet, but on a core basis we are continuing to see NIM expansion in line with expectations and moving up towards that.
And if you look at the proposal that was sent out for comments, not only did it have a large number of questions that they were asking the feedback on but their actual proposal was very similar to what we have been understanding was the intention in speeches that go back a fair way, which is to say that it feels like were still making the sausage rather than this is a done deal.
And just my follow-up question is, the pushback that I am getting from a lot of investors on bank stocks is that we are long in the tooth in the economic cycle.
And I am wondering, both Jamie and Marianne, how you would respond to that pushback that now its not the time to invest in banks because we are late in the game from an economic standpoint?
I think its very easy that rates can go up, the 10-year rates can go up in a healthy environment.
So, while we still feel like that is our outlook at this point, we obviously are going to make the right decisions, based upon the environment that were in.
As we look out for the full year, to the degree that we would be above our -- our outlook is $63 billion, it would be largely driven, if not exclusively driven, by higher performance-related compensation on higher revenues, with the only other caveat that as you probably know, we are waiting as Im sure you are for when the FDIC surcharge is taken away.
And if I could just ask a quick follow-up, and I apologize if you addressed it earlier, a lot of multitasking this morning, but on the market side, you did much better than what Daniel suggested in his update in terms of year-on-year being flattish overall.
Marianne, can you share with us, and correct me if Im wrong, I think you guys have given us some color in the past about the impact of the fed taking down their balance sheet over the next three to five years by a couple trillion dollars that it will impact your deposit side of the balance sheet.
Its a little bit less credit terms but still pretty robust, albeit that we are seeing a tiny shift to the right in LTVs. Were not going there, by the way, but I would call it pretty modest.
I think, its good for the country, United States that we have a fully competitive field in card, mortgage, retail, asset management, commercial banking, investment banking, sales and trading.
While there were more catalysts this quarter, but you mentioned Italy, I think.
To follow up on the net interest margin, you mentioned ex the markets business it was still increasing.
But for us, the reason why its pretty limited -- not to say theres no other impact, but the reason why itll be mostly driven by the areas I mentioned is because in most of our wholesale space and so many of our other products, we are covered for multiple years, if not close to life of loan at this point.
But basically, its still kind of what we expect over time.
",58.35,0.8108974
