Company,Quadrant,Year,Summary,Linguistic Complexity(Flesch Scores),Sentiment
jpmc,q2,2015,"The improvement to both ratios was driven by net capital generation, along with an overall reduction to risk weighted assets primarily from lower risk across market and counterparty credit as well as some data enhancements with loan growth offsetting run off.
On the previous page you may have seen that HQLA was down $82 billion this quarter, primarily reflecting those lower levels of cash.
Quarter-on-quarter the reduction in cash drove a 4 basis point improvement was partially offset by lower yields and as I said, Firm NII was flat.
Net interest income was flat sequentially with modest spread compression offset by deposit growth and NIR was up 7% seasonally and 2% year-on-year on continued strong client investment and debit revenue.
Weve recently signed several new strategic clients, including Chevron, Cinemark, Gap Inc., Marriott and Rite Aid. Together they represent an incremental 5% to our volume and the majority have signed up for ChaseNet. Lastly in Auto, results continue to reflect steady growth in new vehicle sales and stable used car values.
This quarter we continued to rank number one in global IB fees with 8.2% wallet share and widening the gap for number two.
Given the reporting changes weve made going forward, we should expect that for treasury services revenues would be about $875 million plus or minus per quarter and lending approximately $350 million and thats given the trade finance transfer.
Were fully expecting to see normal seasonal declines in the third quarter markets revenues.
We also saw continued momentum in IB revenue off of a record last quarter which was driven by a large transaction.
C&I loans grew 3% sequentially in line with the industry with middle market growth being somewhat challenged by strong competition, but with more strength in corporate client banking, driven by short-term financing activity and new facilities for our existing client base.
Driven by continued net long term inflows marking the 25th consecutive quarter at $13 billion with strength in North America and multi-asset flows, driving record AUM of $1.8 trillion up 4% year-on-year and client assets of $2.4 trillion.
My first question is the capital progress has clearly been solid this quarter.
So we actually havent really changed our point of view since Investor Day and previously about the fact that we are expecting retail deposit and there are other people who have slightly different views, but we are expecting retail deposit to reprice higher and faster in this cycle than in previous rising rate cycles, given the competition so good high quality LTR compliant retail deposit, given the advancements in mobile banking, given the awareness in the general environment around low rates and the desire to participate in rising rates.
I see your markets revenue are down 1% year-over-year the way you look at this, but Im trying to reconcile that with Jamies comments two months ago at a New York conference where you said there is repricing in rates, derivatives, prime brokerage clearing and trade finance.
Yes. I mean, I just give you some very specific things and I will tell you why it's hard to figure out exactly what shows up.
In other categories, clients are like deposits we haven't seen repricing effectively.
Your next question comes from the line of John McDonald with Sanford Bernstein.
Marianne mentioned it, but emphasis, Chase Paymentech which youre seeing really good growth probably 50% fast in the industry.
I think were doing a great job servicing clients.
Can you give us some color on what youre seeing whether its underwriting standards and what kind of product type in the middle market that is most competitive?
But then I look at like total assets in the CIB, its $845 billion this quarter versus $846 billion last year.
Just following up on the markets discussion, curious whether or not youve seen some of the drama around Greece impact the M&A discussions in Europe this quarter and maybe an update on the IB Bank backlog at this point?
The M&A we dont Greece has expected the M&A dialogue very much, because its been very active pretty much around the world.
And mostly around the world its also like European companies coming to America, American companies going to Europe et cetera and those conversations continue 
Psychologically maybe its going to affect some people, but I dont see why a company that has its own ambitions is going to change them because of Greece.
Marianne gave you all very specific guidelines which you dont normally do on treasury services, investor services and expenses in the commercial bank because a lot of you have your models wrong.
Because I got a few questions on whether the deposit betas being a little faster means that the NIM trajectory is likely to be different from last time rates rose for you guys.
Okay, because the last time rates rose your NIM didnt move up that much.
The quarters performance was characterized by strong underlying fundamentals across each of our businesses with stable NIM and NII, good growth in fee drive as well as strong IB fees, good expense discipline with adjusted expenses flat quarter-on-quarter at $14.2 billion and an adjusted overhead ratio of 58% and low levels of charge offs and core loans up 12% year-on-year.
Year-to-date our balance sheet is down over $120 billion on a spot basis, driven by a reduction of over $100 billion of non-operating deposits across our wholesale businesses partially offset by continued growth in consumer deposits.
We also saw a $36 billion reduction in trading assets and secured financing as we continue to make progress simplifying our balance sheet.
The performance for the combined consumer businesses was characterized by sequential revenue growth on stronger fee revenue and positive operating leverage, generating $2.5 billion of net income, an ROE of 19% and an overhead ratio of 56%.
Moving to consumer business banking on Page 6, CBB generated net income of $831 million, flat quarter-on-quarter and down 8% year-on-year with an ROE of 28%.
Average deposit balances up 9% or $41 billion year-on-year and were pleased to see that 30% of this growth is driven by our investments in Business Banking and CPC and new builds.
Client investment assets were a record, up 8% to $16 billion and in Business Banking Average loan balances were up 6% with loan originations flat against a record last year and in a highly competitive environment.
Total revenue increased sequentially, primarily driven by higher MSR revenue, but as you can see -- you look at our non-interest revenue its down $500 million year-on-year.
We still expect non-interest revenue to be down about $1 billion for the full-year in line with previous guidance.
Expenses of $1.1 billion were down $200 million or 15% year-on-year and down 9% quarter-on-quarter despite higher volume as we continue to manage down our costs.
On credit, we continue to see improvements in home prices and delinquencies and as a result we released $300 million of NCI reserve this quarter and you can see our charge-off rate were 21 basis points.
Revenue of $4.7 billion was up 3% year-on-year on Card sales volume and Auto loan and lease growth, partially offset by spread compression.
Moving on to markets, revenue of $4.5 billion was down 1% year-on-year, excluding business simplification and the gain in the prior year on the IPO of market which we previously disclosed, but with strong relative performance and rates and in equity markets.
And as I mentioned, equity market had another strong quarter, up 27% year-on-year on revenue of $1.6 billion with strong performance in all three regions relative to last year and outperformance in Asia, particularly China and Hong Kong on the back of client interests first to participate in the rally and later to hedge.
Looking forward, business simplification would drive a 9% decline year-on-year in third-quarter markets revenues with a corresponding decline in expenses.
And as I look into the third quarter in analyst models, I see relative to our markets results this quarter you have revenues in markets going up sequentially.
In commercial Banking the underlying businesses continue to perform well with strong loan growth, up $6 billion quarter-on-quarter and record end of period loan balances with good credit fundamentals and low non-performing loans.
Revenue was flat year-on-year driven by continued spread compression in loans and deposits, partially offset by growth in loans and flat sequentially despite the record investment banking performance in the first quarter.
CRE loans grew 5% and continue to exceed the industry on strong activity in both commercial term lending, which had record originations in the quarter and in real estate banking.
Moving on to Page 11 and Asset Management, net income of $451 million on revenue of $3.2 billion, reflected solid growth up 6% year-on-year and 6% quarter-on-quarter.
So to wrap up, strong reported and strong underlying results this quarter across our businesses and an environment that continue to remain somewhat challenging with double-digit core loan growth, with broad-based strength in our underlying drivers, and with continued execution and excellent progress against our capital, our balance sheet and expense commitments.
And I guess the question is in two parts: one, what do you think the chances are of the -- any or all of the CCAR surcharge or the CET1 surcharge to be included in CCAR; and two, what are the next steps in terms of business model adjustments, if that did pass?
Meanwhile, as you know, we are -- and by the way, it happens for us, it happens for everyone and weve shown you before not that -- good outcome, but weve shown you before that we think that regardless the competitive peers set that we have is going to cluster at or around similar capital levels.
So it's kind of a whole of the amount of things taking place in there, but the goal is to get a proper return to your capital not necessarily to show revenue growth in that line-item.
But the second is we will likely look to potentially push a little farther, but if we get harder and harder, each margin, the next $5 billion or $10 billion, as you get more and more closely aligned operating accounts in operating business and we have always said that we want to do this for the right reason for capital efficiency, but not do it in a way that its going to materially harm our clients.
In terms of revenue impact, not very much right now as you might very well know, because you can see that the balance is much more on a spot basis than on an average basis, but the equation looking forward will be much the same as said at Investor Day, approximately 25 basis points revenue on approximately $100 billion average for half a year, but that would be some expense benefit on FDIC cost etcetera, so not a very big number.
Yes, so let me do this in two parts and I'm going to start with the consumer businesses where the commitment is actually a couple of years old and we are sort of well low on our way to delivering against, the commitment $2 billion in 17 versus 14 and its not exactly linear, but you can consider it to flow through time and if you look at the CCB page on whatever page that is, I think we show that for the first half of the year our expenses are down over the first half of last year by $0.5 billion.
So if I have to look at the first half of 15 versus the first half of 14, take the 500 in consumer and business simplification in the CIB space, thats probably the right way to size it about a quarter so far this year.
So thats a little better, but obviously on the standardized you have somewhat put pressure as we continue to grow those really great loans that were growing.
We built another modest reserve at this quarter, and we said we dont -- we might expect more reserves in the second half of the year, theres another redetermination cycle in the fall and its -- Im not going to say likely, but its possible well be selectively downgrading some time.
Your commentary about credit, so the second half is in line, youre $4 billion plus and you had a $1 billion of charge offs this quarter again.
Are we getting to a point where youre lapping some of these higher reward costs in growth and new accounts, we should start to see that revenue line track more closely with spending or is this something unusual this quarter.
And yes over time as spread compression abates and we continue to drive strong growth with the quality of our products and our partnerships, we would expect that to start too agile.
I just want to point out that trading, if you look at it over a long period of time its been -- weve become very consistent.
We know that that the refis have started to come down but the purchase market has been stronger I think than people expected in the second quarter.
And remember if you look at the whole relationship side, I forgot the exact number, but if you look at middle market relationships, I think somewhat like half maybe even a little bit less of the revenues are from the lending.
So you would see, I think Gordon said approximately 150 net down in each of the next couple of years and thats probably still the right way to look at it, but its really perfecting that it worth moving branches to the areas we like, whether the high density of affluence.
Hi, I was just curious about the reduction of the non-operating deposits, and I would have expected that to come mainly out of the Corporate and Investment Bank and -- but when you look at the disclosures on your average asset level its essentially been $850 billion plus/minus each over the last five quarters.
You see securities going down but strong loan growth offsetting and then small reductions in trading and secured financing.
Yes, I think if you go back to last quarter Brennan and take a look at the remarks in last quarter, we talked about the change in presentation of some expenses versus revenues for the ADR business, that drove a reduction but just a classification issue and then in addition we did loose a large client at the end of last year and that is having an impact.
And I think its a mistake not to grow because youre going to have tough times.
We expect that and were going to look right through that and the fact that their -- and also the market went from $4 trillion value, so its $10 trillion economy.
Marianne, earlier on you were talking about deposit betas and for a lot of very good reasons, expecting that deposit betas will be a little bit faster this time around.
Thats what were trying to do and its all in that number that we present it and we dont think thats changed dramatically.
",44.92,0.7672526
